#CODE;ENGLISH;;;;;;;;;;;;;x
EVTDESC_li_zoroastrian_205;You have decided to rebuild the capital of the ancient Persian empire, albeit in a slightly new location. You commission quarries to deliver large amounts of marble and gather masons from around the realm to build it. How ambitious should this project be?;Vous avez décidé de reconstruire la capitale de l'Ancien Empire Perse, bien que dans un lieu légèrement différent. Vous commandez aulx carrières de grandes quantités de marbre et rassemblez des maçons de tout le royaume pour la construction. À quel point ce projet devroit-il estre ambitieulx ?;You have decided to rebuild the capital of the ancient Persian empire, albeit in a slightly new location. You commission quarries to deliver large amounts of marble and gather masons from around the realm to build it. How ambitious should this project be?;;You have decided to rebuild the capital of the ancient Persian empire, albeit in a slightly new location. You commission quarries to deliver large amounts of marble and gather masons from around the realm to build it. How ambitious should this project be?;;;;;;;;;x,,,,,,,,,,,,,,,,,,,,,,,,,,,,,
EVTOPTC_li_zoroastrian_205;Make it even greater than it was!;Le rendre encor plus grand qu'il n'estoit !;Make it even greater than it was!;;Make it even greater than it was!;;;;;;;;;x,,,,,,,,,,,,,,,,,,,,,,,,,,,,,,,,,
EVTNAME_li_zoroastrian_206;Persepolis Rebuilt!;Persépolis Reconstruite !;Persepolis Rebuilt!;;Persepolis Rebuilt!;;;;;;;;;x,,,,,,,,,,,,,,,,,,,,,,,,,,,,,,,,,
EVTDESC_li_zoroastrian_206;The new city is almost complete. What do you want to work on as a great project to complete the city? You can rebuild the ancient library to further our scholars' work, you can reconstruct the irrigation system to allow you to support more troops, or you can rebuild the Gate of all nations to dazzle the emissaries from the peoples you subjugated.;Votre nouvelle cité est bientost achevée. Quel seroit le grand projet de votre choilx pour parachever la cité ? Vous pouvez reconstruire l'ancienne bibliothèque pour faire avancer le labeur de nos érudits, vous pouvez reconstruire le système d'irrigation pour vous permettre de sustenir davantage de troupes, ou vous pouvez reconstruire la Porte De Toutes Les Nations pour éblouir les émissaires des peuples que vous avez subjugués.;The new city is almost complete. What do you want to work on as a great project to complete the city? You can rebuild the ancient library to further our scholars' work, you can reconstruct the irrigation system to allow you to support more troops, or you can rebuild the Gate of all nations to dazzle the emissaries from the peoples you subjugated.;;The new city is almost complete. What do you want to work on as a great project to complete the city? You can rebuild the ancient library to further our scholars' work, you can reconstruct the irrigation system to allow you to support more troops, or you can rebuild the Gate of all nations to dazzle the emissaries from the peoples you subjugated.;;;;;;;;;x,,,,,,,,,,,,,,,,,,,,,,,,,
EVTOPTA_li_zoroastrian_206;Rebuild the library.;Reconstruire la bibliothèque.;Rebuild the library.;;Rebuild the library.;;;;;;;;;x,,,,,,,,,,,,,,,,,,,,,,,,,,,,,,,,,
EVTOPTB_li_zoroastrian_206;Reconstruct the irrigation system.;Reconstruire le système d'irrigation.;Reconstruct the irrigation system.;;Reconstruct the irrigation system.;;;;;;;;;x,,,,,,,,,,,,,,,,,,,,,,,,,,,,,,,,,
EVTOPTC_li_zoroastrian_206;Rebuild the Gate of All Nations.;Reconstruire la Porte de toutes les nations.;Rebuild the Gate of all nations.;;Rebuild the Gate of all nations.;;;;;;;;;x,,,,,,,,,,,,,,,,,,,,,,,,,,,,,,,,,
EVTNAME_li_zoroastrian_207;New Persepolis;;;;;;;;;x,,,,,,,,,,,,,,,,,,,,,,,,,,,,,,,,,
EVTDESC_li_zoroastrian_207;The task is complete. New Persepolis has been erected.;La besogne est enfin achevée. La Nouvelle Persépolis est érigée.;The task is complete. New Persepolis has been erected.;;The task is complete. New Persepolis has been erected.;;;;;;;;;x,,,,,,,,,,,,,,,,,,,,,,,,,,,,,,,,,
EVTOPTA_li_zoroastrian_207;Our Empire will never fall again and the world will bathe in our splendor..;;;;;;;;;x,,,,,,,,,,,,,,,,,,,,,,,,,,,,,,,,,
EVTNAME_li_zoroastrian_210;Persepolis is restored!;Persépolis est restaurée !;Persepolis is restored!;;Persepolis is restored!;;;;;;;;;x,,,,,,,,,,,,,,,,,,,,,,,,,,,,,,,,,
EVTDESC_li_zoroastrian_210;The splendor of Persepolis has been restored many centuries after the destruction of the original in around 330 BC by Alexander the Great. In a new location, New Persepolis seeks to be the beacon of renewed hope at the heart of a new Persian Empire. Already many Persians are seeking to expand the borders of their reborn realm even further.;;;;;;;;;;x,,,,,,,,,,,,,,,,,,,,,,,,,,,,
EVTOPTA_li_zoroastrian_210;Worrisome...;Inquiétant...;Beunruhigend ...;;Inquietante...;;;;;;;;;x,,,,,,,,,,,,,,,,,,,,,,,,,,,,,,,,,
EVTNAME_li_zoroastrian_215;Immortal Once More;Immortel Une Nouvelle Fois;Immortal Once More;;Immortal Once More;;;;;;;;;x,,,,,,,,,,,,,,,,,,,,,,,,,,,,,,,,,
EVTDESC_li_zoroastrian_215;With the formation of the Persian kingdom, an old terror returns to the world. The Zhayedan (or, as they are more commonly known, Immortals) number 10000 and seek to strike fear into the hearts of the enemies of the Persians. These elite units are comparable to the Greek cataphracts of their time and are equipped with only the finest of equipment and horses. Truly they are a force worthy of the world’s attention.;Avec la formation du Royaume Perse, une vieille terreur reprend le monde. Les Zhayedan (mieulx connus sous le nom d'Immortels), forts de 10 000 hommes, quièrent à inspirer la peur dans le coeur des ennemis des Perses. Ces unités d'élite sont comparables aulx cataphractes grecques en leur temps et sont équipées avec équipement et chevaulx de tout premier ordre. Ils constituent une force réellement digne de l'attention du monde.;With the formation of the Persian kingdom an old terror returns to the world. The Zhayedan (or, as more commonly known, Immortals) number 10000 and seek to strike fear into the hearts of the enemies of the Persians. These elite units are comparable to the Greek cataphracts of their time and are equipped with only the finest of equipment and horses. Truly they are a force worthy of the world’s attention.;;With the formation of the Persian kingdom an old terror returns to the world. The Zhayedan (or, as more commonly known, Immortals) number 10000 and seek to strike fear into the hearts of the enemies of the Persians. These elite units are comparable to the Greek cataphracts of their time and are equipped with only the finest of equipment and horses. Truly they are a force worthy of the world’s attention.;;;;;;;;;x,,,,,,,,,,,,,,,,,,,,,,,,
EVTNAME_li_zoroastrian_216;A New Persian Empire;Un nouvel Empire Perse;A new Persian Empire;;A new Persian Empire;;;;;;;;;x,,,,,,,,,,,,,,,,,,,,,,,,,,,,,,,,,
EVTDESC_li_zoroastrian_216;With the reformation of the Persian Empire and the growing of its borders, the Shahanshah has decided that a second force of Zhayedan elites will be required. It would be a grave mistake to underestimate the power of this resurgent Persian Empire, as no one can doubt their legitimacy at this point. But in what direction will their ambitions drive them?;Avec la reformation de l'Empire Perse et l'agrandissement de ses frontières, le Shahanshah a décidé qu'une seconde armée d'élite Zhayedan sera nécessaire. Ce seroit une grave erreur que de sous-estimer cet Empire Perse renaissant, comme personne peult douter de leur force dorénavant. Mais dans quelle direction leur ambition les mènera-t-elle ?;With the reformation of the Persian Empire and the growing of its borders, the Shahanshah has decided that a second force of Zhayedan elites will be required. It would be a grave mistake to underestimate the power of this resurgent Persian Empire, as no one can doubt their legitimacy at this point. But in what direction will their ambitions drive them?;;With the reformation of the Persian Empire and the growing of its borders, the Shahanshah has decided that a second force of Zhayedan elites will be required. It would be a grave mistake to underestimate the power of this resurgent Persian Empire, as no one can doubt their legitimacy at this point. But in what direction will their ambitions drive them?;;;;;;;;;x,,,,,,,,,,,,,,,,,,,,,,,,,
EVTNAME_li_zoroastrian_220;The Great Sacrifice;Le Grand Sacrifice;The Great Sacrifice;;The Great Sacrifice;;;;;;;;;x,,,,,,,,,,,,,,,,,,,,,,,,,,,,,,,,,
EVTDESC_li_zoroastrian_220;You feel the time is right to make a great sacrifice to one of the yazata, the divinities of Zoroastrianism. As you begin to plan the event, you realize that you haven’t even decided on which divinity to sacrifice to. After some deliberation you decide to make a great sacrifice…;;;;;;;;;;x,,,,,,,,,,,,,,,,,,,,,,,,,,,,
EVTOPTA_li_zoroastrian_220;...to Mitra, a divinity associated with war.;... à Mithra, une divinité associée à la guerre.;... to Mithra, a divinity associated with war.;;... to Mithra, a divinity associated with war.;;;;;;;;;x,,,,,,,,,,,,,,,,,,,,,,,,,,,,,
EVTOPTB_li_zoroastrian_220;...to Parendi, a divinity associated with riches.;... à Parendi, une divinité associée à la richesse.;... to Parendi, a divinity associated with riches.;;... to Parendi, a divinity associated with riches.;;;;;;;;;x,,,,,,,,,,,,,,,,,,,,,,,,,,,,,
EVTOPTC_li_zoroastrian_220;...to Chisti, a divinity associated with wisdom.;... à Chisti, une divinité associée à la sagesse.;... to Chisti, a divinity associated with wisdom.;;... to Chisti, a divinity associated with wisdom.;;;;;;;;;x,,,,,,,,,,,,,,,,,,,,,,,,,,,,,
EVTOPTD_li_zoroastrian_220;...to none of them. It was a silly idea after all.;... à nul d'entre eulx. C'estoit une idée beste finalement.;... to none of them. It was a silly idea after all.;;... to none of them. It was a silly idea after all.;;;;;;;;;x,,,,,,,,,,,,,,,,,,,,,,,,,,,,,,,,,
EVTNAME_li_zoroastrian_225;The Cleansing Ritual;Le Rituel de Purification;The Cleansing Ritual;;The Cleansing Ritual;;;;;;;;;x,,,,,,,,,,,,,,,,,,,,,,,,,,,,,,,,,
EVTDESC_li_zoroastrian_225;You approach a set of 6 holes about two feet deep for the ritual. The closest three are filled with gomez (consecrated bull’s urine, an effective ancient sanitizer). The furthest three are filled with water. There is a holy fire on the far end and you come to the realization that the priests are waiting for you to begin the ritual. As you recite Yasna 49 with the priests and approach the first gomez filled hole.;Vous vous approchez d'un ensemble de 6 trous d'environ 60cm de profondeur pour le rituel. Les trois les plus proches sont remplis de gomez (de l'urine de taureau sanctifiée, un désinfectant ancien mais efficace). Les trois trous les plus éloignés sont remplis d'eau. Il y a un feu sacré tout au bout et vous réalisez que les prestres n'attendent que vous pour commencer le rituel. Tandis que vous récitez le verset 49 du Yasna avec les prestres, vous vous approchez du premier trou rempli de gomez.;You approach a set of 6 holes about two feet deep for the ritual. The closest three are filled with gomez (consecrated bull’s urine, an effective ancient sanitizer). The furthest three are filled with water. There is a holy fire on the far end and you come to the realization that the priests are waiting for you to begin the ritual. As you recite Yasna 49 with the priests and approach the first gomez filled hole.;;You approach a set of 6 holes about two feet deep for the ritual. The closest three are filled with gomez (consecrated bull’s urine, an effective ancient sanitizer). The furthest three are filled with water. There is a holy fire on the far end and you come to the realization that the priests are waiting for you to begin the ritual. As you recite Yasna 49 with the priests and approach the first gomez filled hole.;;;;;;;;;x,,,,,,,,,,,,,,,,,,,,,,,,,,,,
EVTOPTA_li_zoroastrian_225;I praise Thee, O Mazda Ahura, in my hymns and expect enjoying what Thou deemest the best.;Loué sois-Tu, Ô Ahura Mazda, mes hymnes T'accompagnent et ma vie sera telle que Tu auras jugé bon qu'elle soit.;I praise Thee, O Mazda Ahura, in my hymns and expect enjoying what Thou deemest the best.;;I praise Thee, O Mazda Ahura, in my hymns and expect enjoying what Thou deemest the best.;;;;;;;;;x,,,,,,,,,,,,,,,,,,,,,,,,,
make_sacrifice;Make a large sacrifice.;Faire un grand sacrifice.;Make a large sacrifice.;;Make a large sacrifice.;;;;;;;;;x;;
make_sacrifice_desc;Make a large sacrifice to a Zoroastrian yazata, a divinity, granting a boon.;Faire un grand sacrifice à une divinité Zoroastrienne, accordant une bénédiction.;Make a large sacrifice to a Zoroastrian divinity, granting a boon.;;Make a large sacrifice to a Zoroastrian divinity, granting a boon.;;;;;;;;;x;;
hold_solar_procession;Celebrate a Solar Procession;;;;;;;;;x
hold_solar_procession_desc;Celebrate the sacred procession of Sol Invictus, protector of [Root.PrimaryTitle.GetName]! An effigy of Sol will be paraded from the main temple of Sol Invictus at [Root.Location.GetName] to your own palace, in order to bless your rule with His might!;;;;;;;;;x
EVTDESC_li_solarprocession_1;A Solar Procession is not a cheap event, decorations must be paid for, and food must be distributed amongst the populace that come to see the glory of Sol Invictus, the more you spend, more pious your image will appear to the general public.;;;;;;;;;x
EVTOPTA_li_solarprocession_1;The best food and splendorous decorations!;;;;;;;;;x
EVTOPTB_li_solarprocession_1;Good food and moderate decorations;;;;;;;;;x
EVTOPTC_li_solarprocession_1;Normal food and small decorations;;;;;;;;;x
EVTNAME_li_solarprocession_5;The Procession of Sol Invictus;;;;;;;;;x
EVTDESC_li_solarprocession_5;The time has finally come for Sol Invictus' sacred procession from the temple of Sol in [Root.Location.GetName] to your palace, symbolic of His fall every sunset and rise every dawnbreak. At the head of the procession are images of foreign gods, come from far and wide, preceding and later flanking Sol Invictus, like servants before their only lord and master. Then comes the radiant icon of Sol Invictus himself: a golden sun, shaded by the image a great eagle, it's wings spread open. The image is carried on a great chariot with ornaments, drawn by 4 pristine white horses and driven and occupied by no one else but Sol Invictus.\n Last in the procession is you, on foot and flanked by your generals, ministers and guards, as even the greatest of rulers in this earth are nothing when compared to the glory of Sol.;;;;;;;;;x
EVTOPT_li_solarprocession_5;Deus Sol Invictus Maximus!;;;;;;;;;x
EVTNAME_li_solarprocession_20;;;;;;;;;;x
EVTDESC_li_solarprocession_20;With the image of Sol placed in your palace's balcony, you prepare to give a speech to the onlooking populace, under Sol Invictus' auspices. Everyone is expectant of what their [Root.GetTitle] has to say for this year's event...;;;;;;;;;x
EVTOPT_solar_speech;"Citizens...";;;;;;;;;x
EVTNAME_li_solarprocession_100;Select Speech type;;;;;;;;;x
EVTDESC_li_solarprocession_100;You give a short introduction praising the people of [Root.PrimaryTitle.GetName] for their support to the realm. As you continue your speech, it is clear that you must announce the direction of your realm for the next year...;;;;;;;;;x
EVTOPTA_li_solarprocession_100;"...The armies of [Root.PrimaryTitle.GetName] are on the verge of success..." ;;;;;;;;;x
EVTOPTB_li_solarprocession_100;"...The wealth of [Root.PrimaryTitle.GetName] will expand beyond measure...";;;;;;;;;x
EVTOPTC_li_solarprocession_100;"...[Root.PrimaryTitle.GetName], Sol Invictus watches over us!...";;;;;;;;;x
GIVESPEECH;You prepare to give the speech...;;;;;;;;;x
EVTDESCGOODSPEECH_MIL;You give a great speech, showing your skills as orator and giving your best rhetoric into it. In the speech, you praise the efforts of your armies to expand the influence and glory [Root.PrimaryTitle.GetName];;;;;;;;;x
EVTDESCGOODSPEECH_ECO;You give a great speech, showing your skills as orator and giving your best rhetoric into it. In the speech, you praise the efforts of your realm to expand the economic influence of [Root.PrimaryTitle.GetName];;;;;;;;;x
EVTDESCGOODSPEECH_REL;You give a great speech, showing your skills as orator and giving your best rhetoric into it. In the speech, you praise the might of Sol Invictus, and commend the efforts of the priesthood in order to connect [Root.PrimaryTitle.GetName] to his will.;;;;;;;;;x
EVTOPTA_lux_graecoromanfest.101;The people are delighted!;;;;;;;;;x
EVTDESCBADSPEECH_MIL;You give a clumsy speech, dotted with many uncomfortable pauses and stutter all the way through. In the speech, you try to praise the efforts of your armies to expand the influence and glory [Root.PrimaryTitle.GetName];;;;;;;;;x
EVTDESCBADSPEECH_ECO;You give a clumsy speech, dotted with many uncomfortable pauses and stutter all the way through. In the speech, you try to praise the efforts of your realm to expand the economic influence of [Root.PrimaryTitle.GetName];;;;;;;;;x
EVTDESCBADSPEECH_REL;You give a clumsy speech, dotted with many uncomfortable pauses and stutter all the way through. In the speech, you try to praise the might of Sol Invictus, and commend the efforts of the priesthood in order to connect [Root.PrimaryTitle.GetName] to his will;;;;;;;;;x
EVTOPTA_lux_graecoromanfest.102;The people jeer you!;;;;;;;;;x
EVTDESC_li_solarprocession_500;The time has come give the event a closing. The image of Sol is delivered back to the temple by the priests in a much more discrete ceremony, the banners are taken down, and the people return to their homes. They all agree, though, it was a great ceremony.;;;;;;;;;x
EVTOPTA_li_solarprocession_500;Praise Sol Invictus!;;;;;;;;;x
EVTNAME_li_solinvsacrifice_199;Select sacrifice name;;;;;;;;;x
EVTDESC_li_solinvsacrifice_199;Select sacrifice desc;;;;;;;;;x
EVTOPT_solar_sacrifice_prisoner;Sacrifice human;;;;;;;;;x
EVTOPT_solar_sacrifice_hecatomb;Sacrifice cattle;;;;;;;;;x
EVTNAME_li_solinvsacrifice_200;Sacrifice victim name;;;;;;;;;x
EVTDESC_li_solinvsacrifice_200;Sacrifice victim desc;;;;;;;;;x
EVTOPT_sol_sacrifice_victim;Select sacrifice desc;;;;;;;;;x
EVTNAME_li_solinvsacrifice_201;Sacrifice human name;;;;;;;;;x
EVTDESC_li_solinvsacrifice_201;Sacrifice human desc;;;;;;;;;x
EVTOPT_solar_sac_emperor;The [From.GetTitle] of [From.PrimaryTitle.GetName]!;;;;;;;;;x
TXT_sacrifice_emperor;Sacrificing a rival Emperor will bring great glory to our realm!\n;;;;;;;;;x
EVTOPT_solar_sac_rel_head;The [From.GetTitle] of the [From.Religion.GetName]s!;;;;;;;;;x
TXT_sacrifice_rel_head;Sacrificing an enemy Religious Head will bring great glory to Sol Invictus!\n;;;;;;;;;x
EVTOPT_solar_sac_normal;This one!;;;;;;;;;x
EVTNAME_li_solinvsacrifice_213;Sacrifice victim pov name;;;;;;;;;x
EVTDESC_li_solinvsacrifice_213;Sacrifice victim pov desc;;;;;;;;;x
EVTNAME_li_solinvsacrifice_215;Sacrifice cattle name;;;;;;;;;x
EVTDESC_li_solinvsacrifice_215;Sacrifice cattle desc;;;;;;;;;x
sacrificed_enemy_rel_head;Sacrificed infidel Religious Head;;;;;;;;x
held_solar_procession;Celebrated a Solar Procession;;;;;;;;x
sacrifice_sol_invictus;Offer a great sacrifice to Sol Invictus;;;;;;;;x
sacrifice_sol_invictus_desc;Prepare a great, public sacrifice to Sol Invictus. While a Hecatomb of cattle will be enough as sacrifice, we can also offer an enemy of our realm to the flames of Sol Invictus. Sacrificing a prestigious enemy, like an Emperor or a Religious Head will bring even more glory to Sol.\n This kind of sacrifice can only be made every 2 years.;;;;;;;;x
SOL_sac_hecatomb;The cattle is prepared for sacrifice...;;;;;;;;x
SOL_sac_prisoner;A prisoner is prepared for sacrifice...;;;;;;;;x
sol_choose_speech;You choose which speech type go give...;;;;;;;;x
grant_estate;Grant Estates;;;;;;;;;;;;;x
grant_estate_desc;Grant landed estates to this character. This will give them a monthly revenue and make them more loyal to you.;;;;;;;;;;;;;x
CONSIDER_MINOR_ESTATE;Consider the size of the estate that will be granted to §Y[Root.GetTitledFirstName]§! (you will also have the opportunity to reconsider, if you wish).\n;;;;;;;;;x
EVTNAMEluxyazd.10123;Peacock's Feathers;;;;;;;;;x
EVTDESCluxyazd.10123;You sit alone in your room, quietly studying scripture, when one of your guards bursts in without warning. You quickly grab the knife you keep hidden on your person, expecting some sort of trouble, until one of your advisers enters the room. You listen to the man, who explains that a miracle has happened, and that you are needed in the throne room at once. You get dressed quickly and follow your advisor to the throne room, which is packed with courtiers. Before you can demand an explanation, one of your guards points to your throne. As you move towards your throne you notice a glowing feather lying in front of it, one of the symbols of the Peacock Angel. Your courtiers bow as you pick it up, the feather's glow intensifying as you hold it in your hands.;;;;;;;;;x
EVTOPTAluxyazd.10123;We have been blessed!;;;;;;;;;x
peacocks_feather;Peacock's Feather;;;;;;;;;x
hold_tawusgeran;Observe Tawusgeran;;;;;;;;;x
hold_tawusgeran_desc;Hold a Tawusgeran festival.;;;;;;;;;x
EVTDESCluxyazd.10124;The sacred images are paraded around the nearby villages by the priests. These images are made of brass, and symbolize Tawuse Melek, the Peacock Angel. Holy water is also distributed and taxes are collected from the pious in the name of [Root.Religion.GetHighGodNameCap].;;;;;;;;;;x
EVTOPTAluxyazd.10124;Glory to [Root.Religion.GetHighGodNameCap]!;;;;;;;;;;x
EVTDESCluxyazd.10125;With the sacred images taken back to their resting place, it is time to celebrate! Invitations have gone out to your vassals asking them to join you for a grand feast honoring [Root.Religion.GetRandomGodName]. You have decided to make this years feast a special one, remembered by both spirits and men for years to come.;;;;;;;;;;x
EVTTOOLTIPluxyazd.10127;The invitations to the Tawusgeran celebration are are sent.;;;;;;;;;x
EVTDESCluxyazd.10127;[From.GetTitledFirstName], your liege, has invited you to join [From.GetHerHim] for this years Tawusgeran feast. There you will celebrate the blessings of the sacred images and pay tribute to the Peacock Angel, the leader of God's seven archangels.;;;;;;;;;x
EVTDESCluxyazd.10128;[From.GetTitledFirstName] has declined your invitation to attend the Tawusgeran feast! Apparently [From.GetSheHe] has no faith in Melek Taus and the other angels, and instead follows the strange rituals of some other religion that is foreign to our ways.;;;;;;;;;x
EVTDESCluxyazd.10129;Your vassals have arrived and the time of the Tawusgeran feast is upon us. Bulls and oxen are sacrificed to honor the Peacock Angel, sermons are preached by the priests, and guests are blessed with holy water.;;;;;;;;;x
EVTOPTAluxyazd.10129;We honor you, [Root.Religion.GetHighGodNameCap];;;;;;;;;;x
EVTDESCluxyazd.10130;At last, the time of the Tawusgeran feast is upon us. Bulls and oxen are sacrificed to honor the Peacock Angel, sermons are preached by the priests, and guests are blessed with holy water.;;;;;;;;;x
EVTDESCluxyazd.10131;With mass ended and sacrifices made, you gather together with your vassals for the great feast your servants have prepared!;;;;;;;;;x
EVTDESCluxyazd.10132;With mass ended and sacrifices made, you gather together with your liege and the rest of [From.GetHerHis] vassals for the great feast [From.GetSheHe] has prepared!;;;;;;;;;x
EVTDESCluxyazd.10133;The food is gone, and the festival has come to an end. Your vassals are returning home, but you all agree that this years Tawusgeran celebration was well worth the trip.;;;;;;;;;x
EVTDESCluxyazd.10134;The food is gone, and the festival has come to an end. You and the other vassals are returning home, but you all agree that this years Tawusgeran celebration was well worth the trip.;;;;;;;;;x
yazidi_pilgrimage;Visit the tomb of Sheik Adi.;;;;;;;;;x
yazidi_pilgrimage_desc;Some faithful [Root.Religion.GetName] decide to make a great pilgrimage at some point in their lives.  The devout pilgrim is prepared to travel long distances in order to visit the tomb of the religion's founder, Sheikh Adi ibn Musafir.;;;;;;;;;x
EVTDESCluxyazd.10163;I shall go on a pilgrimage to seek God's grace at one of the holy places of our faith.;;;;;;;;;x
EVTOPTAluxyazd.10163;I shall start making travel plans.;;;;;;;;;;x
EVTOPTAluxyazd.10164;Onwards to Lalish!;;;;;;;;;;x
EVTOPTAluxyazd.10166;What a waste of time!;;;;;;;;;;x
EVTOPTAluxyazd.10167;A worthwhile trip!!;;;;;;;;;;x
EVTOPTAluxyazd.10169;Fight them!;;;;;;;;;;x
EVTOPTBluxyazd.10169;Run away!;;;;;;;;;;x
EVTOPTAluxyazd.10170;Victory and honor!;;;;;;;;;;x
EVTOPTAluxyazd.10171;That was close...;;;;;;;;;;x
EVTOPTAluxyazd.10172;We keep going;;;;;;;;;;x
EVTOPTBluxyazd.10172;Stay for a while;;;;;;;;;;x
EVTOPTAluxyazd.10173;Drop your weapons;;;;;;;;;;x
EVTOPTBluxyazd.10173;Kill the assassin!;;;;;;;;;;x
EVTOPTAluxyazd.10176;Help him;;;;;;;;;;x
EVTOPTBluxyazd.10176;Leave him;;;;;;;;;;x
EVTOPTAluxyazd.10177;Here you go;;;;;;;;;;x
EVTOPTBluxyazd.10177;Don't even touch me!;;;;;;;;;;x
EVTOPTAluxyazd.10178;We'll go back;;;;;;;;;;x
EVTOPTBluxyazd.10178;We'll keep going;;;;;;;;;;x
EVTDESCluxyazd.10164;The most important holy site to [Root.Religion.GetName]s is the tomb of the religion's founder, Sheikh Adi ibn Musafir, which is located at Lalish, north of Mosul. You may face trouble if you come into contact with any of the areas Muslims or Christians, who consider Yazidis to be devil worshippers, but this is a once in a life-time opportunity.;;;;;;;;;x
EVTNAMEluxyazd.10165;Sheikh's Tomb.;;;;;;;;;x
