#CODE;ENGLISH;;;;;;;;;;;;;x
ENEMY_REALM_HORRIFIED;Enemy realm is horrified!\n;Enemy realm is horrified!\n;Enemy realm is horrified!\n;;Enemy realm is horrified!\n;;;;;;;;;x,,,,,,,,,,,,,,,,,,,,,,,,,,,,,,,,,
MEN_ARE_ANGERED;The [Root.Culture.GetName] warriors are angered\n;The [Root.Culture.GetName] warriors are angered\n;The [Root.Culture.GetName] warriors are angered\n;;The [Root.Culture.GetName] warriors are angered\n;;;;;;;;;x;;
MEN_ARE_PLEASED;The [Root.Culture.GetName] warriors are pleased\n;The [Root.Culture.GetName] warriors are pleased\n;The [Root.Culture.GetName] warriors are pleased\n;;The [Root.Culture.GetName] warriors are pleased\n;;;;;;;;;x;;
EVTTOOLTIPsiegeescaped;We manage to escape.;;;;;;;;;;;;;x
EVTTOOLTIPsiegehide;Will be smuggled out of [From.Siege.GetName] and into hiding\n;Will be smuggled out of [From.Siege.GetName] and into hiding\n;Will be smuggled out of [From.Siege.GetName] and into hiding\n;;Will be smuggled out of [From.Siege.GetName] and into hiding\n;;;;;;;;;,,,,,,,,,,,,,,,,,,,,,,,,,,,,,,,,,
EVTTOOLTIPsiegeremain;Remains at [From.Siege.GetName] and could be captured\n;Remains at [From.Siege.GetName] and could be captured.\n;Remains at [From.Siege.GetName] and could be captured.\n;;Remains at [From.Siege.GetName] and could be captured.\n;;;;;;;;;,,,,,,,,,,,,,,,,,,,,,,,,,,,,,,,,,
siege_captured;is successfully captured\n;is successfully captured\n;is successfully captured\n;;is successfully captured\n;;;;;;;;;x,,,,,,,,,,,,,,,,,,,,,,,,,,,,,,,,,
siege_escaped;escapes to the countryside\n;escapes to the countryside\n;escapes to the countryside\n;;escapes to the countryside\n;;;;;;;;;x,,,,,,,,,,,,,,,,,,,,,,,,,,,,,,,,,
siege_injured;is injured but escapes to the countryside\n;is injured but escapes to the countryside\n;is injured but escapes to the countryside\n;;is injured but escapes to the countryside\n;;;;;;;;;x,,,,,,,,,,,,,,,,,,,,,,,,,,,,,,,,,
siege_killed;is found and slain\n;is found and slain\n;is found and slain\n;;is found and slain\n;;;;;;;;;x,,,,,,,,,,,,,,,,,,,,,,,,,,,,,,,,,
siege_sacrificed;is found and sacrificed\n;is found and sacrificed\n;is found and sacrificed\n;;is found and sacrificed\n;;;;;;;;;x,,,,,,,,,,,,,,,,,,,,,,,,,,,,,,,,,
opinion_barbarian;Barbarian;Barbarian;Barbarian;;Barbarian;;;;;;;;;;;
not_allowed_to_loot;Prevented Me From Looting;Prevented Me From Looting;Prevented Me From Looting;;Prevented Me From Looting;;;;;;;;;x;;
looting_sacrifice;Made Sacrifice After Looting;Made Sacrifice After Looting;Made Sacrifice After Looting;;Made Sacrifice After Looting;;;;;;;;;x;;
EVTNAME_li_waylit_1001;Fight or Flee?;Fuire ou Combattre ?;Fight or Flee?;;Fight or Flee?;;;;;;;;;,,,,,,,,,,,,,,,,,,,,,,,,,,,,,,,,,
EVTDESC_li_waylit_1001;My [Root.GetLordLady], an enemy host is quickly approaching [From.Siege.GetName] with the intent to besiege it. What shall we do?;My [Root.GetLordLady], an enemy host is quickly approaching [From.Siege.GetName] with the intent to besiege it. What shall we do?;My [Root.GetLordLady], an enemy host is quickly approaching [From.Siege.GetName] with the intent to besiege it. What shall we do?;;My [Root.GetLordLady], an enemy host is quickly approaching [From.Siege.GetName] with the intent to besiege it. What shall we do?;;;;;;;;;,,,,,,,,,,,,,,,,,,,,,,,,,,,,,
EVTOPTA_li_waylit_1001;Remain and defend [From.Siege.GetName];Remain and defend [From.Siege.GetName];Remain and defend [From.Siege.GetName];;Remain and defend [From.Siege.GetName];;;;;;;;;,,,,,,,,,,,,,,,,,,,,,,,,,,,,,,,,,
EVTOPTB_li_waylit_1001;Send my family into hiding at once;Envoyer ma famille se cacher;Send my family into hiding at once;;Send my family into hiding at once;;;;;;;;;,,,,,,,,,,,,,,,,,,,,,,,,,,,,,
EVTOPTC_li_waylit_1001;I will take my family and hide until it is safe;Je vais emmener ma famille et nous cacher jusqu'à ce que ce soit susr;I will take my family and hide until it is safe;;I will take my family and hide until it is safe;;;;;;;;;,,,,,,,,,,,,,,,,,,,,,,,,,,,,,,,,,
EVTOPTD_li_waylit_1001;Send my family into hiding. I will remain here;Send my family into hiding. I will remain here;Send my family into hiding. I will remain here;;Send my family into hiding. I will remain here;;;;;;;;;,,,,,,,,,,,,,,,,,,,,,,,,,,,,,,,,,
EVTOPTE_li_waylit_1001;I will go into hiding at once. Good luck!;I will go into hiding at once. Good luck!;I will go into hiding at once. Good luck!;;I will go into hiding at once. Good luck!;;;;;;;;;,,,,,,,,,,,,,,,,,,,,,,,,,,,,,,,,,
EVTOPTF_li_waylit_1001;There is nothing to be done. It is in the hands of [Root.Religion.GetRandomGodName];There is nothing to be done. It is in the hands of [Root.Religion.GetRandomGodName];There is nothing to be done. It is in the hands of [Root.Religion.GetRandomGodName];;It is in the hands of [Root.Religion.GetRandomGodName];;;;;;;;;,,,,,,,,,,,,,,,,,,,,,,,,,,,,,,,,,
EVTNAME_li_waylit_1005;Escape Attempt;Tentative d'évasion;Escape Attempt;;Escape Attempt;;;;;;;;;,,,,,,,,,,,,,,,,,,,,,,,,,,,,,,,,,
EVTDESC_li_waylit_1005;My [Root.GetLordLady], if [Root.Siege.GetName] falls into the hands of the enemy, you could be placed into jeopardy. If you are going to attempt an escape, it must be now. We will not get another chance.;My [Root.GetLordLady], if [Root.Siege.GetName] falls into the hands of the enemy, you could be placed into jeopardy. If you are going to attempt an escape, it must be now. We will not get another chance.;My [Root.GetLordLady], if [Root.Siege.GetName] falls into the hands of the enemy, you could be placed into jeopardy. If you are going to attempt an escape, it must be now. We will not get another chance.;;My [Root.GetLordLady], if [Root.Siege.GetName] falls into the hands of the enemy, you could be placed into jeopardy. If you are going to attempt an escape, it must be now. We will not get another chance.;;;;;;;;;,,,,,,,,,,,,,,,,,,,,,,,,,,,
EVTOPTA_li_waylit_1005;Slip out a postern door at midnight;Se faufiler à l'extérieur du castel à travers une poterne à minuit.;Slip out a postern door at midnight.;;Slip out a postern door at midnight.;;;;;;;;;,,,,,,,,,,,,,,,,,,,,,,,,,,,,,,,,,
EVTOPTB_li_waylit_1005;Brave the sewers;Braver les égousts.;Brave the sewers.;;Brave the sewers.;;;;;;;;;,,,,,,,,,,,,,,,,,,,,,,,,,,,,,,,,,
EVTOPTC_li_waylit_1005;Just give me a rope...;Donnez-moi seulement une corde...;Just give me a rope...;;Just give me a rope...;;;;;;;;;,,,,,,,,,,,,,,,,,,,,,,,,,,,,,,,,,
EVTOPTD_li_waylit_1005;I think it's better we wait;Je crois que le mieulx est d'attendre.;I think it's better we wait.;;I think it's better we wait.;;;;;;;;;,,,,,,,,,,,,,,,,,,,,,,,,,,,,,,,,,
EVTDESC_li_waylit_1006;Just as I thought I had made it to freedom, a group of armed men appear under the banner of my foe.  Exhausted from my escape, it is all I can do to croak the word 'yield.';Alors que je songeois avoir réussi à recouvrer ma liberté, un groupe d'hommes armés apparoist, portant l'étendard de mon ennemi. Exténué par mon évasion, tout ce que je puis faire est de lascher d'une voix rauque Je me rends.;Just as I thought I had made it to freedom, a group of armed men appear under the banner of my foe.  Exhausted from my escape, it is all I can do to croak the word 'yield.';;Just as I thought I had made it to freedom, a group of armed men appear under the banner of my foe.  Exhausted from my escape, it is all I can do to croak the word 'yield.';;;;;;;;;,,,,,,,,,,,,,,,,,,,,,,,,
EVTDESC_li_waylit_1007;In the dead of night, as a low mist hung about the curtain wall, you creep out a postern door and float across the moat on an inflated sheepskin.  It's only by the ineptitude of the enemy watch that you stagger, dripping wet, through the siege lines and to the safety of a nearby wood.  Thanks be to God! ... Although any family left behind is likely angry with us...;Au milieu de la nuitée, tandis que la brume envahit les murs extérieurs, vous vous faufilez à travers une poterne et traversez les douves sur une peau de mouton gonflée d'air. Ce n'est que grasce au manque de vigilance des gardes ennemis que vous réussissez à franchir, trempé jusqu'aulx os, les lignes de siège et gagnez la sécurité du bois voisin. Dieu soit loué ! ... Bien que tout membre de ma famille laissé derrière moi sera probablement courroucé envers moi...;In the dead of night, as a low mist hung about the curtain wall, you creep out a postern door and float across the moat on an inflated sheepskin.  It's only by the ineptitude of the enemy watch that you stagger, dripping wet, through the siege lines and to the safety of a nearby wood.  Thanks be to God! ... Although any family left behind is likely angry with us...;;In the dead of night, as a low mist hung about the curtain wall, you creep out a postern door and float across the moat on an inflated sheepskin.  It's only by the ineptitude of the enemy watch that you stagger, dripping wet, through the siege lines and to the safety of a nearby wood.  Thanks be to God! ... Although any family left behind is likely angry with us...;;;;;;;;;,,,,,,,,,,,,,,,,,
EVTDESC_li_waylit_1008;Your steward leads you down into the store rooms to a passage you didn't even know existed.  Beyond it, a dismal tunnel full of death and decay, and you are only too glad to reach the moat and relatively fresh water. I hope I never have to do that again!  It only now occurs to me that any family left behind is likely angry with me for leaving them in the hands of the enemy.;Votre chancelier vous guide à travers les salles de stockage dans un chemin dont vous ne soupçonniez mesme point l'existence. Au bout, un sombre tunnel qui puire la mort et la décomposition, et vous n'estes que trop heureulx d'atteindre les douves et son eau relativement fraische. J'espère que je n'auroi li_waylit jamais à faire ça ! Ce n'est qu'alors que je réalise que les membres de ma famille que j'ai pu laisser derrière moi vont prob1ablement estre courroucés que je les aie abandonnés entre les mains de l'ennemi.;Your steward leads you down into the store rooms to a passage you didn't even know existed.  Beyond it, a dismal tunnel full of death and decay, and you are only too glad to reach the moat and relatively fresh water. I hope I never have to do that again!  It only now occurs to me that any family left behind is likely angry with me for leaving them in the hands of the enemy.;;Your steward leads you down into the store rooms to a passage you didn't even know existed.  Beyond it, a dismal tunnel full of death and decay, and you are only too glad to reach the moat and relatively fresh water. I hope I never have to do that again!  It only now occurs to me that any family left behind is likely angry with me for leaving them in the hands of the enemy.;;;;;;;;;,,,,,,,,,,,,,,,,,,,,,,,,,
EVTDESC_li_waylit_1009;They said only a lunatic would attempt climbing down the southeast wall, and certainly the enemy agreed!  A near thing, too, when my foot slipped on that patch of moss.  My brush with death over with, and safety assured, it only now occurs to me that any family left behind will see this as a desertion, not a bold deed of heroism...;Ils disoient que seul un fol essaieroit de descendre le mur du sud-est, et l'ennemi devoit susrement estre d'accord ! C'est vrai que ce n'est point passé loin, quand mon pied a glissé sur cette touffe de mousse. Ma danse avec la mort une fois terminée, et ma sécurité assurée, ce n'est qu'alors que je réalise que tout membre de ma famille que j'ai pu laisser derrière verra susrement mon acte comme une désertion, et non comme un exploit audacieulx et héroïque...;They said only a lunatic would attempt climbing down the southeast wall, and certainly the enemy agreed!  A near thing, too, when my foot slipped on that patch of moss.  My brush with death over with, and safety assured, it only now occurs to me that any family left behind will see this as a desertion, not a bold deed of heroism...;;They said only a lunatic would attempt climbing down the southeast wall, and certainly the enemy agreed!  A near thing, too, when my foot slipped on that patch of moss.  My brush with death over with, and safety assured, it only now occurs to me that any family left behind will see this as a desertion, not a bold deed of heroism...;;;;;;;;;,,,,,,,,,,
EVTDESC_li_waylit_1010;My [Root.GetLordLady], we've caught [From.GetTitledName] while [From.GetSheHe] was trying to sneak out of the castle!;Mon seigneur, nous avons mis la main sur le commandant ennemi s'échappant du castel !;My [Root.GetLordLady], we've caught [From.GetTitledName] while [From.GetSheHe] was trying to sneak out of the castle!;;My [Root.GetLordLady], we've caught [From.GetTitledName] while [From.GetSheHe] was trying to sneak out of the castle!;;;;;;;;;,,,,,,,,,,,,,,,,,,,,,,,,,,,,,
EVTOPTA_li_waylit_1010;Take [From.GetHerHim] back to my dungeons immediately!;Ramenez-les sur-le-champ aulx cachots de mon castel !;Take [From.GetHerHim] back to my dungeons immediately!;;Take [From.GetHerHim] back to my dungeons immediately!;;;;;;;;;,,,,,,,,,,,,,,,,,,,,,,,,,,,,,,,,,
EVTDESC_li_waylit_1021;My [Root.GetLordLady], we've finally taken [FromFrom.GetName]... and it appears [FromFrom.Holder.GetTitledFirstName] numbers among those within. What should we do?;My [Root.GetLordLady], we've finally taken [FromFrom.GetName]... and it appears [FromFrom.Holder.GetTitledFirstName] numbers among those within. What should we do?;My [Root.GetLordLady], we've finally taken [FromFrom.GetName]... and it appears [FromFrom.Holder.GetTitledFirstName] numbers among those within. What should we do?;;My [Root.GetLordLady], we've finally taken [FromFrom.GetName]... and it appears [FromFrom.Holder.GetTitledFirstName] numbers among those within. What should we do?;;;;;;;;;,,,,,,,,,,,,,,,,,,,,,,,,,,,,,,,,,
EVTOPTA_li_waylit_1021;Take [FromFrom.Holder.GetHerHim] prisoner at once;Take [FromFrom.Holder.GetHerHim] prisoner at once;Take [FromFrom.Holder.GetHerHim] prisoner at once;;Take [FromFrom.Holder.GetHerHim] prisoner at once;;;;;;;;;,,,,,,,,,,,,,,,,,,,,,,,,,,,,,,,,,
EVTOPTB_li_waylit_1021;Imprison [FromFrom.Holder.GetHerHim] and anyone else we find;Imprison [FromFrom.Holder.GetHerHim] and anyone else we find;Imprison [FromFrom.Holder.GetHerHim] and anyone else we find;;Imprison [FromFrom.Holder.GetHerHim] and anyone else we find;;;;;;;;;,,,,,,,,,,,,,,,,,,,,,,,,,,,,,,,,,
EVTOPTC_li_waylit_1021;Kill [FromFrom.Holder.GetHerHim] and anyone else within;Kill [FromFrom.Holder.GetHerHim] and anyone else within;Kill [FromFrom.Holder.GetHerHim] and anyone else within;;Kill [FromFrom.Holder.GetHerHim] and anyone else within;;;;;;;;;,,,,,,,,,,,,,,,,,,,,,,,,,,,,,,,,,
EVTOPTD_li_waylit_1021;Leave [FromFrom.Holder.GetHerHim] and [FromFrom.Holder.GetHerHis] family be;Leave [FromFrom.Holder.GetHerHim] and [FromFrom.Holder.GetHerHis] family be;Leave [FromFrom.Holder.GetHerHim] and [FromFrom.Holder.GetHerHis] family be;;Leave [FromFrom.Holder.GetHerHim] and [FromFrom.Holder.GetHerHis] family be;;;;;;;;;,,,,,,,,,,,,,,,,,,,,,,,,,,,,,
EVTDESC_li_waylit_1022;My [Root.GetLordLady], we've finally taken [FromFrom.GetName]... but it appears [FromFrom.Holder.GetTitledFirstName] has gone into hiding. We can search for [FromFrom.Holder.GetHerHim], but [FromFrom.Holder.GetSheHe] will not be easy to find. What would you have us do?;My [Root.GetLordLady], we've finally taken [FromFrom.GetName]... but it appears [FromFrom.Holder.GetTitledFirstName] has gone into hiding. We can search for [FromFrom.Holder.GetHerHim], but [FromFrom.Holder.GetSheHe] will not be easy to find. What would you have us do?;My [Root.GetLordLady], we've finally taken [FromFrom.GetName]... but it appears [FromFrom.Holder.GetTitledFirstName] has gone into hiding. We can search for [FromFrom.Holder.GetHerHim], but [FromFrom.Holder.GetSheHe] will not be easy to find. What would you have us do?;;My [Root.GetLordLady], we've finally taken [FromFrom.GetName]... but it appears [FromFrom.Holder.GetTitledFirstName] has gone into hiding. We can search for [FromFrom.Holder.GetHerHim], but [FromFrom.Holder.GetSheHe] will not be easy to find. What would you have us do?;;;;;;;;;,,,,,,,,,,,,,,,,,,,,,,,,,,,,,,,,,
EVTOPTA_li_waylit_1022;Find [FromFrom.Holder.GetHerHim]—[FromFrom.Holder.GetSheHe]'s the only one we want;Find [FromFrom.Holder.GetHerHim]—[FromFrom.Holder.GetSheHe]'s the only one we want;Find [FromFrom.Holder.GetHerHim]—[FromFrom.Holder.GetSheHe]'s the only one we want;;Find [FromFrom.Holder.GetHerHim]—[FromFrom.Holder.GetSheHe]'s the only one we want;;;;;;;;;,,,,,,,,,,,,,,,,,,,,,,,,,,,,,,,,,
EVTOPTB_li_waylit_1022;Find [FromFrom.Holder.GetHerHim] and anyone else of importance;Find [FromFrom.Holder.GetHerHim] and anyone else of importance;Find [FromFrom.Holder.GetHerHim] and anyone else of importance;;Find [FromFrom.Holder.GetHerHim] and anyone else of importance;;;;;;;;;,,,,,,,,,,,,,,,,,,,,,,,,,,,,,,,,,
EVTOPTC_li_waylit_1022;Kill everyone you can find;Kill everyone you can find;Kill everyone you can find;;Kill everyone you can find;;;;;;;;;,,,,,,,,,,,,,,,,,,,,,,,,,,,,,,,,,
EVTDESC_li_waylit_1023;My [Root.GetLordLady], we've finally taken [FromFrom.GetName], and it appears that [FromFrom.Holder.GetTitledFirstName] may have family within... though some may have gone into hiding. If they have, they may not be very easy to find. What would you have us do?;My [Root.GetLordLady], we've finally taken [FromFrom.GetName], and it appears that [FromFrom.Holder.GetTitledFirstName] may have family within... though some may have gone into hiding. If they have, they may not be very easy to find. What would you have us do?;My [Root.GetLordLady], we've finally taken [FromFrom.GetName], and it appears that [FromFrom.Holder.GetTitledFirstName] may have family within... though some may have gone into hiding. If they have, they may not be very easy to find. What would you have us do?;;My [Root.GetLordLady], we've finally taken [FromFrom.GetName], and it appears that [FromFrom.Holder.GetTitledFirstName] may have family within... though some may have gone into hiding. If they have, they may not be very easy to find. What would you have us do?;;;;;;;;;,,,,,,,,,,,,,,,,,,,,,,,,,,,,,,,,,
EVTOPTA_li_waylit_1023;Imprison anyone of importance you can find;Imprison anyone of importance you can find;Imprison anyone of importance you can find;;Imprison anyone of importance you can find;;;;;;;;;,,,,,,,,,,,,,,,,,,,,,,,,,,,,,,,,,
EVTOPTC_li_waylit_1023;Leave them be, they are unimportant;Leave them be, they are unimportant;Leave them be, they are unimportant;;Leave them be, they are unimportant;;;;;;;;;,,,,,,,,,,,,,,,,,,,,,,,,,,,,,,,,,
EVTDESC_li_waylit_1024;My [Root.GetLordLady], our forces report that [FromFrom.Holder.GetTitledFirstName] has prisoners being held at [FromFrom.GetName].;My [Root.GetLordLady], our forces report that [FromFrom.Holder.GetTitledFirstName] has prisoners being held at [FromFrom.GetName].;My [Root.GetLordLady], our forces report that [FromFrom.Holder.GetTitledFirstName] has prisoners being held at [FromFrom.GetName].;;My [Root.GetLordLady], our forces report that [FromFrom.Holder.GetTitledFirstName] has prisoners being held at [FromFrom.GetName].;;;;;;;;;,,,,,,,,,,,,,,,,,,,,,,,,,
EVTOPTA_li_waylit_1024;Release all prisoners;Relascher tous les prisonniers.;Release all prisoners.;;Release all prisoners.;;;;;;;;;,,,,,,,,,,,,,,,,,,,,,,,,,,,,,,,,,
EVTOPTB_li_waylit_1024;Transfer them to MY dungeon;Transfer them to MY dungeon;Transfer them to MY dungeon;;Transfer them to MY dungeon;;;;;;;;;,,,,,,,,,,,,,,,,,,,,,,,,,,,,,,,,,
EVTOPTC_li_waylit_1024;Release anyone with whom we have common cause.;Relascher tous ceulx avec qui nous partageons une cause commune.;Release anybody with whom we have common cause.;;Release anybody with whom we have common cause.;;;;;;;;;,,,,,,,,,,,,,,,,,,,,,,,,,,,,,,,,,
EVTOPTD_li_waylit_1024;Release only my relatives;Release only my relatives;Release only my relatives;;Release only my relatives;;;;;;;;;,,,,,,,,,,,,,,,,,,,,,,,,,,,,,,,,,
EVTOPTE_li_waylit_1024;Whoever these people are, they smell like they belong there...;Qui que soient ces gueulx, ils ont l'air d'estre à leur place ici...;Whomever these people are, they smell like they belong here...;;Whomever these people are, they smell like they belong here...;;;;;;;;;,,,,,,,,,,,,,,,,,,,,,,,,,,,,,
EVTDESC_li_waylit_1026;As the forces of [From.GetTitledFirstName] finally burst through the gates of [FromFromFrom.GetName], you assumed they would take you prisoner if they found you... but that was not to be. You heard the screams before they reached you, and, upon realizing they were slaughtering everyone, you tried to flee. Eventually they caught up to you and summarily put you to the sword.;As the forces of [From.GetTitledFirstName] finally burst through the gates of [FromFromFrom.GetName], you assumed they would take you prisoner if they found you... but that was not to be. You heard the screams before they reached you, and, upon realizing they were slaughtering everyone, you tried to flee. Eventually they caught up to you and summarily put you to the sword.;As the forces of [From.GetTitledFirstName] finally burst through the gates of [FromFromFrom.GetName], you assumed they would take you prisoner if they found you... but that was not to be. You heard the screams before they reached you, and, upon realizing they were slaughtering everyone, you tried to flee. Eventually they caught up to you and summarily put you to the sword.;;As the forces of [From.GetTitledFirstName] finally burst through the gates of [FromFromFrom.GetName], you assumed they would take you prisoner if they found you... but that was not to be. You heard the screams before they reached you, and, upon realizing they were slaughtering everyone, you tried to flee. Eventually they caught up to you and summarily put you to the sword.;;;;;;;;;,,,,,,,,,,,,,,,,,,,,,,,,,,,,,
EVTOPTA_li_waylit_1026;I will be avenged!;I will be avenged!;I will be avenged!;;I will be avenged!;;;;;;;;;,,,,,,,,,,,,,,,,,,,,,,,,,,,,,
EVTDESC_li_waylit_1027;As the forces of [From.GetTitledFirstName] finally burst through the gates of [FromFromFrom.GetName], you attempted to evade them... but ultimately were unsuccessful.;As the forces of [From.GetTitledFirstName] finally burst through the gates of [FromFromFrom.GetName], you attempted to evade them... but ultimately were unsuccessful.;As the forces of [From.GetTitledFirstName] finally burst through the gates of [FromFromFrom.GetName], you attempted to evade them... but ultimately were unsuccessful.;;As the forces of [From.GetTitledFirstName] finally burst through the gates of [FromFromFrom.GetName], you attempted to evade them... but ultimately were unsuccessful.;;;;;;;;;,,,,,,,,,,,,,,,,,,,,,,,,,,,,,
EVTDESC_li_waylit_1029;After the siege, we found §Y[From.GetTitledName]§! and immediately took [From.GetHerHim] prisoner.;After the siege, we found §Y[From.GetTitledName]§! and immediately took [From.GetHerHim] prisoner.;After the siege, we found §Y[From.GetTitledName]§! and immediately took [From.GetHerHim] prisoner.;;After the siege, we found §Y[From.GetTitledName]§! and immediately took [From.GetHerHim] prisoner.;;;;;;;;;x
EVTDESC_li_waylit_1031;We have finally taken [FromFrom.GetName], and the men are already busy looting and setting fires. A glorious day! Before things go too far, I could give the men instructions, though they won't appreciate being restricted too much.;We have finally taken [FromFrom.GetName], and the men are already busy looting and setting fires. A glorious day! Before things go too far, I could give the men instructions?though, I warn you, they will not appreciate being restricted too much.;We have finally taken [FromFrom.GetName], and the men are already busy looting and setting fires. A glorious day! Before things go too far, I could give the men instructions?though, I warn you, they will not appreciate being restricted too much.;;We have finally taken [FromFrom.GetName], and the men are already busy looting and setting fires. A glorious day! Before things go too far, I could give the men instructions?though, I warn you, they will not appreciate being restricted too much.;;;;;;;;;x
EVTOPTA_li_waylit_1031;Tell them to control themselves, I want prisoners;Tell them to control themselves?I want prisoners;Tell them to control themselves?I want prisoners;;Tell them to control themselves?I want prisoners;;;;;;;;;x
EVTOPTB_li_waylit_1031;No, let them celebrate their victory;No, let them celebrate their victory;No, let them celebrate their victory;;No, let them celebrate their victory;;;;;;;;;x
EVTOPTC_li_waylit_1031;Tonight we offer sacrifices to [Root.Religion.GetRandomGodNameCap]!;Tonight we offer sacrifices to [Root.Religion.GetRandomGodNameCap]!;Tonight we offer sacrifices to [Root.Religion.GetRandomGodNameCap]!;;Tonight we offer sacrifices to [Root.Religion.GetRandomGodNameCap]!;;;;;;;;;x
EVTDESC_li_waylit_1032;As the attackers finally burst through the gates of [FromFromFrom.GetName], you attempted to evade them... and, while you were ultimately successful in escaping, you did not do so unscathed.;As the barbarians finally burst through the gates of [FromFromFrom.GetName], you attempted to evade them... and, while you were ultimately successful in escaping, you did not do so unscathed.;As the barbarians finally burst through the gates of [FromFromFrom.GetName], you attempted to evade them... and, while you were ultimately successful in escaping, you did not do so unscathed.;;As the barbarians finally burst through the gates of [FromFromFrom.GetName], you attempted to evade them... and, while you were ultimately successful in escaping, you did not do so unscathed.;;;;;;;;;x
EVTOPTA_li_waylit_1032;At least I got away!;At least I got away!;At least I got away!;;At least I got away!;;;;;;;;;x
