#EVENTS;;;;;;;;;;;;;;x
VIETmisc.8228.desc;I wander a field of blurry yet vivid colors, and cannot tell what is above and what is below, what is left and what is right. I am simultaneously floating driftlessly and walking aimlessly. Am I in the primordial churning ocean, or the primeval endless skies? Somewhere deep within myself, though I cannot articulate it, I know that this is the era of dreams, when people could not distinguish between conscious and subconscious, when we walked the dreamscape of the universe under the benevolent watch of [Root.Religion.GetHighGodName].;Je me promène dans un champ de couleurs vives et floues, et je ne peux pas dire ce qui est en haut et ce qui est en bas, ce qui est à gauche et ce qui est à droite. Je flotte simultanément sans dérive et marche sans but. Suis-je dans l'océan de barattage primordial ou dans les cieux primitifs sans fin ? Quelque part au fond de moi, même si je ne peux pas l'articuler, je sais que nous sommes dans l'ère des rêves, lorsque les gens ne peuvent pas distinguer entre conscient et subconscient, lorsque nous parcourons le paysage onirique de l'univers sous la surveillance bienveillante de [Root.Religion.GetHighGodName].;;;;;;;;;;x;x
VIETmisc.8228.a;I know not the beginning nor the end.;Je ne connais ni le début ni la fin.;;;;;;;;;;;;x
VIETmisc.8229.desc;Eons pass before I slowly regain consciousness.\n\nI find myself back in my bed. ;Les siècles passent avant que je reprenne lentement conscience. \n \n Je me retrouve dans mon lit.;;;;;;;;;;x;x
VIETmisc.8229.a;Outside, the sun is rising.;Dehors, le soleil se lève.;;;;;;;;;;;;x
VIETmisc.8230.desc;A quiet campfire burns besides me as I sit down. I have been traveling for aeons in this strange dream of mine. Where am I going, and where have I gone? I know not. It is night, and around me is desert sand, yet I feel neither cold nor hot. The skies above fade in and out of different, unnatural colors such as dark emerald, maroon, or the blue of the ocean's depths. I lie back and watch the flickering stars. How beautiful this world is!;Un feu de camp silencieux brûle à mes côtés lorsque je m'assieds. Je voyage depuis des siècles dans cet étrange rêve. Où vais-je et où suis-je allé ? Je ne sais pas. Il fait nuit et autour de moi, il y a du sable du désert, mais je ne me sens ni froid ni chaud. Les cieux situés au-dessus se fondent dans des couleurs différentes et non naturelles telles que l'émeraude sombre, le marron ou le bleu des profondeurs de l'océan. Je m'allonge et regarde les étoiles qui scintillent. Comme ce monde est beau !;;;;;;;;;;x;x
VIETmisc.8230.a;I fall asleep within my dream.;Je m'endors dans mon rêve.;;;;;;;;;;;;x
VIETmisc.8231.desc;I wake up with a jolt. Am I back in reality? Or in that dream?;Je me réveille avec une secousse. Suis-je de retour dans la réalité ? Ou dans ce rêve ?;;;;;;;;;;x;x
VIETmisc.8231.a;This is reality.;C'est la réalité.;;;;;;;;;;;;x
VIETmisc.8231.b;This is a dream.;C'est le rêve.;;;;;;;;;;;;x
VIETmisc.8231.c;I do not know how to distinguish between the two.;Je ne sais pas comment faire la distinction entre les deux.;;;;;;;;;;;;x
VIETmisc.8231.d;Or am I in another dream within a dream?;Ou suis-je dans un autre rêve dans un rêve ?;;;;;;;;;;;;x
VIETmisc.8232.desc;The sky is like waves of red and yellow and dark pink, as the sun slowly wades itself deeper and deeper into the horizon. "Isn't it lovely?" my companion asks. I don't disagree.\n\nSuddenly, I begin to wake up. What a beautiful sunset I saw in my dream!;Le ciel est comme des vagues de rouge, de jaune et de rose foncé, alors que le soleil s'efface lentement et de plus en plus profond dans l'horizon. "N'est-ce pas charmant ?" demande mon compagnon. Je ne suis pas en désaccord.\n\n Soudain, je commence à me réveiller. Quel beau coucher de soleil j'ai vu dans mon rêve !;;;;;;;;;;x;x
VIETmisc.8232.a;But who was my mysterious companion?;Mais qui était mon compagnon mystérieux ?;;;;;;;;;;;;x
VIETmisc.8233.desc;There is nothing but a river that goes forever, surrounded by the green grass and lush trees and bushes. If I wander too far, I find myself back at the river, somehow. Above the sky is pale blue, and a gentle breeze whispers past me. And so, on and on I go, along the primordial, endless river. Even when I wake up, and try to recall my dream, it doesn't make sense.;Il n'y a rien, mais une rivière qui coule à jamais, entourée d'herbe verte et d'arbres et de buissons luxuriants. Si je m'éloigne trop, je me retrouve de nouveau au bord de la rivière. Au-dessus le ciel est bleu pâle et une douce brise me souffle dessus. Et ainsi de suite, je continue, le long du fleuve primordial et sans fin. Même quand je me réveille et que j'essaie de me rappeler de mon rêve, cela n'a aucun sens.;;;;;;;;;;x;x
VIETmisc.8233.a;How can a river be shaped like that?;Comment une rivière peut-elle être formée comme ça ?;;;;;;;;;;;;x
VIETmisc.8234.desc;I stand on a stage, but one unlike any other I've ever seen before. It is immense in size, more like the throne room of a faraway Emperor. There are bright lights high above, a hundred suns that blind me to the audience below. But even in this dream, I know that I must perform music here. Yet I cannot play. My dream self remembers a painful memory from the past.;Je suis sur une scène, mais unique en son genre. Elle est immense et ressemble plus à la salle du trône d'un empereur lointain. Il y a des lumières brillantes au-dessus, cent soleils qui m'aveuglent au public. Mais même dans ce rêve, je sais que je dois jouer de la musique ici. Pourtant je ne peux pas jouer. Mon rêve de lui-même se souvient d'un souvenir douloureux du passé.;;;;;;;;;;x;x
VIETmisc.8234.a;I sorrowfully watch my instrument.;Je regarde tristement mon instrument.;;;;;;;;;;;;x
VIET_music_of_love_kdrama_text;It is an organ of the oddest shape, I've never seen before. It is both black and white, and its majesty beckons to me. And yet I cannot.;C'est un orgue de la forme la plus étrange, je n'en ai jamais vu auparavant. Il est noir et blanc, et sa majesté me fait signe. Et pourtant je ne peux pas.;;;;;;;;;;x;x
VIETmisc.8235.title;Music of Love;Musique d'amour;;;;;;;;;;x;x
VIETmisc.8235.desc;Far away, at the edge of the stage, hidden behind the curtains, [Root.GetSheHeOpp] stands. "You can do it!" [Root.GetSheHeOpp] mouths to me. "I believe in you!"\n\nI approach the black and white organ with trepidation. Can I still play now, even after what happened back then?\n\nBut I must, if only for [Root.GetHerHimOpp].\n\nI sit before the organ, and begin to play.;Au loin, au bord de la scène, caché derrière les rideaux, [Root.GetSheHeOpp] se dresse. "Tu peux le faire !" [Root.GetSheHeOpp] me parle. "Je crois en toi !" \n\nJ'approche l'orgue noir et blanc avec inquiétude. Puis-je toujours jouer maintenant, même après ce qui s'est passé à l'époque ? \n\nMais je dois le faire, ne serait-ce que pour [Root.GetHerHimOpp]. \n\nJe suis assis devant l'orgue et commence à jouer.;;;;;;;;;;x;x
VIETmisc.8235.a;After waking up, I can still hear the song I played in my head.;Après mon réveil, j'entends toujours la chanson que j'ai jouée dans ma tête.;;;;;;;;;;;;x
VIETmisc.8236.desc;I am lost in a maze of tunnels that never seem to end. No matter where I turn, right or left, I cannot find a way out. No matter where I go, there is no one here. I thought there might have been monsters or bandits lurking about, but my only friends and enemies are the flickers of the occasional torch and the cold stone walls. Nothing exists but the dark passageways.;Je suis perdu dans un labyrinthe de tunnels qui ne semblent jamais se terminer. Peu importe où je tourne, à droite ou à gauche, je ne peux pas trouver un moyen de sortir. Peu importe où je vais, il n'y a personne ici. Je pensais qu'il y avait peut-être des monstres ou des bandits qui me menaçaient, mais mes seuls amis et ennemis sont les scintillements de la torche occasionnelle et des murs de pierre froids. Rien d'autre n'existe que les passages sombres.;;;;;;;;;;x;x
VIETmisc.8236.a;I wake up, sweating, with a feeling of unease.;Je me réveille en transpirant avec un sentiment de malaise.;;;;;;;;;;;;x
VIETmisc.8237.desc;I wander a field that stretches from horizon to horizon, lost. I travel for what seems like years upon years and find no sense of direction, and I grow scared. I beg for some respite. Suddenly, on the horizon, I see something approaching me - a woman dressed in an ethereal dress like clouds in the sky, atop a pale horse. She gazes at me with a neutral expression, and I ask her where I am, and where is the nearest town. She does not speak, but merely points in a certain direction, before riding off and disappearing.;Je me promène dans un champ qui s'étend d'horizon à horizon, perdu. Je voyage pour ce qui me semble des années et des années et je ne trouve aucun sens de l'orientation, et je commence à avoir peur. Je demande un répit. Soudain, à l'horizon, je vois quelque chose qui s'approche de moi : une femme vêtue d'une robe éthérée comme des nuages ??dans le ciel, au sommet d'un cheval pâle. Elle me regarde avec une expression neutre et je lui demande où je suis et quelle est la ville la plus proche. Elle ne parle pas, mais pointe simplement dans une certaine direction, avant de partir et de disparaître.;;;;;;;;;;x;x
VIETmisc.8237.a;I follow her directions.;Je suis ses instructions.;;;;;;;;;;;;x
VIETmisc.8238.desc;Some time later - I do not know how long - the faint image of a village appears. Hurrah! It is just as that mysterious woman pointed to me!\n\nAs I wake up from my strange dream, I can only think of one thing.;Quelque temps plus tard - je ne sais pas combien de temps - la faible image d'un village apparaît. Hourra ! C'est ce que cette mystérieuse femme a désigné pour moi !\n\nLorsque je me réveille de mon rêve étrange, je ne peux penser qu'à une chose.;;;;;;;;;;x;x
VIETmisc.8238.a;Who was that lady?;Qui était cette dame ?;;;;;;;;;;;;x
VIETmisc.8239.desc;He wanders the universe atop his mighty steed, aimlessly, as far as our mortal minds can comprehend. Finally, I meet this figure in my dream, whose appearance and purpose I cannot truly grasp. When I talk or gesture to him, all he does is nod sagely and point towards something far away. I try to reach towards the destination he indicated, but before I arrive, I wake up.;Il parcourt l'univers au sommet de son puissant cheval, sans aucun but, aussi loin que notre esprit mortel puisse le comprendre. Enfin, je rencontre cette figure dans mon rêve, dont je ne peux pas vraiment comprendre l'apparence et le but. Quand je lui parle ou que je lui fais un geste, il ne fait que hocher la tête et se diriger vers quelque chose de lointain. J'essaie d'atteindre la destination qu'il a indiquée, mais avant d'arriver, je me réveille.;;;;;;;;;;x;x
VIETmisc.8239.a;Who was that man, and where did he tell me to go?;Qui était cet homme et où m'a-t-il dit d'aller ?;;;;;;;;;;;;x
VIETmisc.8240.desc;There is a very small but thriving group of Chinese shoemakers living nearby. They ask for your support to help them build a small shrine to the ancient Chinese warlord Liu Bei, who, despite being a distant scion of the Han Dynasty, had humble beginnings as a shoemaker. They say Liu Bei was a virtuous and steadfast man, traits that surely reflect your great rule too.;Un groupe très restreint mais florissant de cordonniers chinois vit à proximité. Ils demandent votre soutien pour les aider à construire un petit sanctuaire à l'ancien seigneur de guerre chinois Liu Bei, qui, bien qu'il soit un lointain héritier de la dynastie des Han, a connu des débuts modestes en tant que cordonnier. Ils disent que Liu Bei était un homme vertueux et résolu, des traits qui reflètent sûrement votre grand règne aussi.;;;;;;;;;;x;x
VIETmisc.8240.a;Good luck with that. I'm sure you don't need my help.;Bonne chance avec ça. Je suis sûr que vous n'avez pas besoin de mon aide.;;;;;;;;;;;;x
VIETmisc.8240.b;I can provide a bit of monetary aid.;Je peux fournir un peu d'aide monétaire.;;;;;;;;;;;;x
VIETmisc.8240.c;I will take the lead in making their dreams become reality.;Je prendrai les devants pour que leurs rêves deviennent réalité.;;;;;;;;;;;;x
VIETmisc.8241.desc;I recently provided protection to a small group of Chinese envoys and travelers in my territory. During their journey, they were attacked by ruthless bandits, but my brave men held them off. In gratitude, one my Chinese guests offered a colorful statue of Guan Yu that is an old family heirloom. Guan Yu was an ancient Chinese general who had been deified as a God of War.;J'ai récemment fourni une protection à un petit groupe d'envoyés et de voyageurs chinois sur mon territoire. Pendant leur voyage, ils ont été attaqués par des bandits impitoyables, mais mes braves hommes les ont retenus. En guise de gratitude, un de mes invités chinois m'a offert une statue colorée de Guan Yu, un ancien héritage de famille. Guan Yu était un ancien général chinois qui avait été déifié en Dieu de la Guerre.;;;;;;;;;;x;x
VIETmisc.8241.a;This demonic statue cannot stay with me!;Cette statue démoniaque ne peut pas rester avec moi !;;;;;;;;;;;;x
VIETmisc.8241.b;Thank them but politely reject their offer.;Remerciez-les mais refusez poliment leur offre.;;;;;;;;;;;;x
VIETmisc.8241.c;Put the statue somewhere suitable in my home.;Placez la statue de façon convenable dans ma maison.;;;;;;;;;;;;x
VIETmisc.8242.desc;A Chinese traveler and poet, who lives in the nearby wilderness, visits my court today, and recites some poetry he recently made. It is stylistically inspired by the poetry of the Three Caos - the great warlord and ruler Cao Cao, and his sons Cao Pi and Cao Zhi - who were influential poets in their day. After he performs it for you, he asks what you think.;Un voyageur et poète chinois, qui vit dans la nature sauvage environnante, est arrivé à ma cour aujourd'hui et récite de la poésie qu'il a récemment composée. Il est stylistiquement inspiré par la poésie des Trois Caos - le grand seigneur de guerre et souverain Cao Cao, et ses fils Cao Pi et Cao Zhi - qui étaient des poètes influents de leur temps. Après l'avoir récité pour vous, il vous demande ce que vous pensez.;;;;;;;;;;x;x
VIETmisc.8242.a;That was bad.;C'était mauvais.;;;;;;;;;;;;x
VIETmisc.8242.b;Very good!;Très bien !;;;;;;;;;;;;x
VIETmisc.8242.c;I like it so much, I'll offer him a place at my court.;J'aime tellement ça, je vais lui offrir une place à ma cour.;;;;;;;;;;;;x
VIETmisc.8243.desc;You meet a wanderer from a land far away, who recently traveled to the far east. He asks you to regale him with interesting stories from his travels, and in the middle of his account, he tells of a popular Chinese saying he heard: "Brothers are like limbs, wives and children are like clothing. Torn clothing can be repaired, but how can broken limbs be mended?";Vous rencontrez un vagabond d'une terre lointaine, qui s'est récemment rendu dans l'extrême orient. Il vous demande de vous régaler d'histoires intéressantes de ses voyages. Au milieu de son récit, il raconte un dicton populaire chinois qui aurait été : "Les frères sont comme les membres, les femmes et les enfants sont comme des vêtements. Les vêtements déchirés peuvent être réparés, mais comment réparer les membres cassés ?";;;;;;;;;;x;x
VIETmisc.8243.a;Siblings are more important than wives or children.;Les frères et sœurs sont plus importants que les épouses ou les enfants.;;;;;;;;;;;;x
VIETmisc.8243.b;How terrible! Our children are our future!;Comme c'est terrible ! Nos enfants sont notre avenir !;;;;;;;;;;;;x
VIETmisc.8243.c;Disagreed. Wives are important, we should respect them.;Pas d'accord. Les femmes sont importantes, nous devrions les respecter.;;;;;;;;;;;;x
VIETmisc.8244.desc;Lately, I have been reading about the heroes and villains of the Three Kingdoms, that era of disunity and conflict in China when the Han Dynasty collapsed into civil war. For centuries, people have told many stories, some more fantastical than others, about the deeds and exploits of this fascinating cast of characters. I in particular have an admiration for the...;Dernièrement, j'ai lu des articles sur les héros et les méchants des Trois Royaumes, cette période de désunion et de conflit en Chine lorsque la dynastie des Han s'est effondrée dans la guerre civile. Pendant des siècles, les gens ont raconté de nombreuses histoires, certaines plus fantastiques que d'autres, sur les actes et les exploits de cette fascinante distribution de personnages. J'ai en particulier une admiration pour ...;;;;;;;;;;x;x
VIETmisc.8244.a;Warlords who sought to create order from chaos.;Les chefs de guerre qui ont cherché à créer de l'ordre à partir du chaos.;;;;;;;;;;;;x
VIETmisc.8244.b;Generals who bravely fought on the battlefield.;Les généraux qui ont bravement combattu sur le champ de bataille.;;;;;;;;;;;;x
VIETmisc.8244.c;Strategists who determined the fates of many.;Les stratèges qui ont déterminé le destin de beaucoup.;;;;;;;;;;;;x
VIETmisc.8244.d;Noblewomen who were influential in their own ways.;Les nobles femmes qui ont eu une influence à leur manière.;;;;;;;;;;;;x
VIETmisc.8245.desc;"The Empire, once united, must divide. Once divided, must unite." Thus had it always been with Chinese history. In that era of disunity, the Three Kingdoms, plenty of powerful, ambitious leaders sought to reunite China, some virtuous, some unscrupulous. There is one in particular I find very inspiring:;«L'Empire, une fois uni, doit se diviser. Une fois divisé, il faut l'unir.» C'était ainsi depuis toujours avec l'histoire chinoise. En cette ère de désunion, les Trois Royaumes, de nombreux dirigeants puissants et ambitieux ont cherché à réunir la Chine, des hommes vertueux et des hommes sans scrupules. Il y en a un en particulier que je trouve très inspirant :;;;;;;;;;;x;x
VIETmisc.8245.a;Cao Cao - cunning and cultured;Cao Cao - rusé et cultivé;;;;;;;;;;;;x
VIETmisc.8245.b;Liu Bei - just and benevolent;Liu Bei - juste et bienveillant;;;;;;;;;;;;x
VIETmisc.8245.c;Sun Quan - hardworking and proud;Sun Quan - travailleur et fier;;;;;;;;;;;;x
VIETmisc.8245.d;Dong Zhuo - tyrannical and merciless;Dong Zhuo - tyrannique et sans merci;;;;;;;;;;;;x
VIETmisc.8246.desc;Many are the names of the generals from the Three Kingdoms period. Whether with blade or spear or halberd or bow, whether on foot or on horseback, it was these men's daring and courage that determined the course of battles - and the course of history. My favorite general happens to be:;Nombreux sont les noms des généraux de la période des trois royaumes. Que ce soit avec une lame, une lance, une hallebarde ou un arc, à pied ou à cheval, c'est l'audace et le courage de ces hommes qui ont déterminé le cours des combats - et le cours de l'histoire. Mon général préféré se trouve être :;;;;;;;;;;x;x
VIETmisc.8246.a;Righteous Guan Yu, who became a God of War;Le juste Guan Yu, qui est devenu un Dieu de la Guerre;;;;;;;;;;;;x
VIETmisc.8246.b;Fiery Zhang Fei, deathly loyal to Liu Bei's cause;Le fier Zhang Fei, fidèle à la cause de Liu Bei;;;;;;;;;;;;x
VIETmisc.8246.c;One-eyed Xiahou Dun, humble soldier of Cao Cao;Le borgne Xiahou Dun, humble soldat de Cao Cao;;;;;;;;;;;;x
VIETmisc.8246.d;Ruthless Lu Bu, the treacherous but unmatched Flying General;L'impitoyable Lu Bu, général volant perfide mais incomparable;;;;;;;;;;;;x
VIETmisc.8247.desc;The strategists, through their manipulations and complex mind games, are the ones who truly hold the power to shape the course of history. Whether it is choosing battle tactics or contemplating administrative policies, they left their mark on the turbulent times of the Three Kingdoms. My favorite is:;Les stratèges, à travers leurs manipulations et leurs jeux complexes d'esprit, sont vraiment ceux qui détenaient le pouvoir de façonner le cours de l'histoire. Qu'il s'agisse de choisir des tactiques de combat ou d'envisager des politiques administratives, ils ont laissé leur marque dans les temps troublés des Trois Royaumes. Mon favori est :;;;;;;;;;;x;x
VIETmisc.8247.a;Zhuge Liang, the peerless sleeping dragon;Zhuge Liang, le dragon endormi sans pareil;;;;;;;;;;;;x
VIETmisc.8247.b;Sima Yi, the calculating politician;Sima Yi, l'homme politique calculateur;;;;;;;;;;;;x
VIETmisc.8247.c;Zhou Yu, the cultured youth;Zhou Yu, la jeunesse cultivée;;;;;;;;;;;;x
VIETmisc.8247.d;Chen Gong, the doomed gentleman;Chen Gong, le gentleman condamné;;;;;;;;;;;;x
VIETmisc.8248.desc;Though it was usually men who fought each other in the arenas of battle and politics during the age of the Three Kingdoms, many women also fought in their own ways as well. Even heaven must know of their stories of hardship, dedication, and bravery, even if many people do not. There are quite a number, but the one I respect the most is:;Bien que ce soient généralement des hommes qui se sont battus dans les champs de bataille et en politique à l'époque des Trois Royaumes, beaucoup de femmes se sont aussi battues à leur manière. Même le paradis doit connaître leurs histoires de difficultés, de dévouement et de courage, même si beaucoup de gens ne le savent pas. Il y en a beaucoup, mais celle que je respecte le plus est :;;;;;;;;;;x;x
VIETmisc.8248.a;Diaochan, who sacrificed herself for a nation;Diaochan, qui s'est sacrifiée pour une nation;;;;;;;;;;;;x
VIETmisc.8248.b;Sun Shangxiang, courageous and skilled in the martial arts;Sun Shangxiang, courageuse et habile dans les arts martiaux;;;;;;;;;;;;x
VIETmisc.8248.c;Qiao sisters, the two charming and talented beauties;Sœurs Qiao, les deux beautés charmantes et talentueuses;;;;;;;;;;;;x
VIETmisc.8248.d;Huang Yueying, who had an unsurpassed mind;Huang Yueying, qui avait un esprit inégalé;;;;;;;;;;;;x
VIETmisc.8249.desc;The Prophet (Peace Be Upon Him) is reported to have said, ‘Verily you shall conquer Constantinople. What a wonderful leader will her leader be, and what a wonderful army will that army be!' Today, this jeweled city, the queen of all cities, still remains in infidel hands. Perhaps one day, a valiant and noble king shall conquer this city in the name of true religion.;Le prophète (que la Paix soit avec lui) aurait dit: «En vérité, vous allez conquérir Constantinople. Quel chef merveilleux sera son chef et quelle armée sera cette armée ! »Aujourd'hui, cette ville ornée de joyaux, reine de toutes les villes, reste toujours aux mains des infidèles. Peut-être qu'un jour, un roi vaillant et noble vaincra cette ville au nom de la vraie religion.;;;;;;;;;;x;x
VIETmisc.8249.a;Perhaps it shall be so.;Peut-être qu'il en sera ainsi.;;;;;;;;;;;;x
VIETmisc.8249.b;Constantinople's walls are too mighty. Is it even possible?;Les murs de Constantinople sont trop puissants. Est-ce même possible ?;;;;;;;;;;;;x
VIETmisc.8249.c;There're more important things out there than a distant dream.;Il y a des choses plus importantes là-bas qu'un rêve lointain.;;;;;;;;;;;;x
VIETmisc.8249.d;If I had the opportunity and resources, I could conquer the city!;Si j'avais l'occasion et les ressources, je pourrais conquérir la ville !;;;;;;;;;;;;x
VIETmisc.8250.desc;Some of Italian merchants based in Constantinople have recently gotten into a number of conflicts with local Roman administrators and noblemen. They argue they need your support to ensure a steady flow of trade in your demesne, while the men under your command argue the Italians cannot be trusted. It is up to you to intervene in their disputes, lest it grows out of hand.;Certains marchands italiens basés à Constantinople ont récemment eu plusieurs conflits avec des administrateurs et des nobles romains. Ils soutiennent qu'ils ont besoin de votre soutien pour assurer un flux régulier des échanges commerciaux dans votre pays, tandis que les hommes sous votre commandement affirment qu'on ne peut faire confiance aux Italiens. C'est à vous d'intervenir dans leurs différends, de peur que cela ne dégénère.;;;;;;;;;;x;x
VIETmisc.8250.a;Support the Italians. We need their business.;Soutenez les Italiens. Nous avons besoin de leurs affaires.;;;;;;;;;;;;x
VIETmisc.8250.b;Support the local notables. We must be cautious with outsiders.;Soutenez les notables locaux. Nous devons être prudents avec les étrangers.;;;;;;;;;;;;x
VIETmisc.8250.c;Support neither - let them sort this out on their own!;Ne soutenez ni l'un ni l'autre - laissez-les régler eux-mêmes !;;;;;;;;;;;;x
VIETmisc.8250.d;Invite an Italian merchant to my court as a representative.;Inviter un marchand italien à ma cour en tant que représentant.;;;;;;;;;;;;x
VIET_italian_merchant_negotiation_cool;That way, we'll have clearer lines of communication. If I and my officials know what the Italians want, it'll be easier to negotiate with them or even manipulate them to our ends!;De cette façon, nous aurons des lignes de communication plus claires. Si mes fonctionnaires et moi-même savons ce que veulent les Italiens, il sera plus facile de négocier avec eux ou même de les manipuler à nos fins !;;;;;;;;;;x;x
VIETmisc.8251.desc;An acquaintance recently returned from a trip to Constantinople. They regale you with tales of the wonders and splendor of the great city, and you listen with eager ears. There are many stories that you would like to hear about, many things you wish to learn, and in particular, you are most interested in learning about the...;Une connaissance est récemment revenue d'un voyage à Constantinople. Il vous régale d'histoires sur les merveilles et la splendeur de la grande ville et vous écoutez avec une oreille avide. Il y a beaucoup d'histoires dont vous aimeriez entendre parler, beaucoup de choses que vous souhaitez apprendre, et en particulier, vous êtes plus intéressé par l'apprentissage ...;;;;;;;;;;x;x
