#EVENTS;;;;;;;;;;;;;;x
VIETmisc.8360.desc;That night, I dreamt I was standing in front of an old woman I never met before. Despite her age, she carried herself with grace, and she curtsied me. "Thank you for your kind gesture earlier today," she said. "Most would have ignored me. Whatever your intentions, your noble deed brings me peace in the afterlife, and I can move on." When I woke up, I was confused.;Cette nuit-là, j'ai rêvé que je me tenais devant une vieille femme que je n'avais jamais rencontrée auparavant. Malgré son âge, elle s'est comportée avec grâce et m'a fait une révérence. "Merci pour votre aimable geste plus tôt dans la journée", a-t-elle déclaré. "La plupart m'auraient ignoré. Quelles que soient vos intentions, votre noble action m'apporte la paix dans l'au-delà, et je peux continuer." Quand je me suis réveillé, j'étais confus.;;;;;;;;;;x;x
VIETmisc.8360.a;There was no way... could it have been?;Il n'y avait aucun moyen ... aurait-elle pu l'être ?;;;;;;;;;;;;x
VIETmisc.8361.desc;An acquaintance of mine was on his deathbed, unconscious and unresponsive for days. His family had gathered around him to pray and prepare his soul for the afterlife, when all of a sudden, he sat up, alert and sharp. His family was relieved and tried to talk to him, thinking he had recovered somehow, yet he just kept asking for me to come visit.;Une de mes connaissances était sur son lit de mort, inconsciente et insensible pendant des jours. Sa famille s'était rassemblée autour de lui pour prier et préparer son âme pour l'au-delà, quand tout d'un coup, il se redressa, alerte et vif. Sa famille a été soulagée et a essayé de lui parler, pensant qu'il s'était rétabli d'une manière ou d'une autre, mais il n'arrêtait pas de me demander de venir lui rendre visite.;;;;;;;;;;x;x
VIETmisc.8361.a;I hastened to come to his bedside to witness this little miracle.;Je m'empressai de venir à son chevet pour assister à ce petit miracle.;;;;;;;;;;;;x
VIETmisc.8362.tooltip; \n\nI wonder why he wanted to see me?;\n\nJe me demande pourquoi il voulait me voir ?;;;;;;;;;;x;x
VIETmisc.8362.desc;When I arrived at his house and entered his bedroom, he clapped with joy, and beckoned me to sit next to him. He inquired about various matters of state and provided me advice, claiming it was given to him by the wise spirits of the deceased. We humored him for an hour or so until he said he was tired, and bid all farewell. The moment he closed his eyes, he passed away.;Quand je suis arrivé chez lui et que je suis entré dans sa chambre, il a applaudi de joie et m'a fait signe de m'asseoir à côté de lui. Il s'enquit de diverses questions d'État et me donna des conseils, affirmant que les sages esprits du défunt les lui avaient donnés. Nous lui avons fait plaisir pendant environ une heure jusqu'à ce qu'il dise qu'il était fatigué et nous lui avons dit au revoir. Au moment où il a fermé les yeux, il est décédé.;;;;;;;;;;x;x
VIETmisc.8362.a;Strangely, his advice turned out to be actually very helpful. ;Étrangement, ses conseils se sont avérés très utiles.;;;;;;;;;;;;x
VIETmisc.8363.desc;I am pouring over a document at my desk at night when I see an adorable little girl scurrying back and forth in my room. Upon seeing each other, we both stare in confusion, so I ask her who she is and why she's here. "I'm cold and hungry," she mumbles shyly. Feeling sorry for her, I point to some food I had left on my table, and tell her to eat some.;Je verse un document sur mon bureau la nuit quand je vois une adorable petite fille se précipiter dans ma chambre. En nous voyant, nous regardons tous les deux dans la confusion, alors je lui demande qui elle est et pourquoi elle est ici. "J'ai froid et j'ai faim", marmonne-t-elle timidement. Me sentant désolée pour elle, je montre du doigt la nourriture que j'avais laissée sur ma table et lui dis d'en manger.;;;;;;;;;;x;x
VIETmisc.8363.a;"Thank you, my [Root.GetLordLady]," she squeaks, before she eats.;"Merci, mon [Root.GetLordLady]", couine-t-elle avant de manger.;;;;;;;;;;;;x
VIETmisc.8364.desc;I suddenly wake up, realizing I must have dozed off while reading, and that the little girl must have been from a dream I had. I go to finish the rest of my food, but contrary to what I remember, none of my meal is left, save for a few crumbs.\n\nThe next morning, when I ask about her, I learned her appearance matched one of my guard's daughters, who passed away from illness a few days ago. The guard, a devout [Root.Religion.GetName] believer, tells me he is certain I helped her soul pass into the afterlife, and thanks me.;Je me réveille soudain, réalisant que je dois m'être assoupi en lisant et que la petite fille doit provenir d'un rêve que j'ai fait. Je vais finir le reste de ma nourriture, mais contrairement à ce que je me souviens, il ne me reste aucun repas, à part quelques miettes.\n\nLe lendemain matin, quand je pose des questions à son sujet, j'ai appris que son apparence correspondait à l'une des filles de ma garde, décédée de maladie il y a quelques jours. Le garde, un croyant dévot [Root.Religion.GetName], me dit qu'il est certain que j'ai aidé son âme à passer dans l'au-delà, et me remercie.;;;;;;;;;;x;x
VIETmisc.8364.a;She was a polite, kind child. She is surely at peace now.;C'était une enfant polie et gentille. Elle est sûrement en paix maintenant.;;;;;;;;;;;;x
VIETmisc.8364.b;It must be a coincidence, but if it makes you feel better.;Ce doit être une coïncidence, mais si cela vous fait vous sentir mieux.;;;;;;;;;;;;x
VIETmisc.8365.desc;A trusted guard recently got injured, and while it thankfully isn't too painful, it's clear that it doesn't bode well for his health as he is now bedridden for much of the day. He is old and about to retire, anyways. One morning, you pay a visit when he tells you his grandparents stopped by just before you did. You point out that they died decades ago, but he assures you they did visit.;Un garde de confiance s'est récemment blessé, et bien que cela ne soit heureusement pas trop douloureux, il est clair que cela n'est pas de bon augure pour sa santé car il est maintenant alité une grande partie de la journée. Il est vieux et sur le point de prendre sa retraite, de toute façon. Un matin, vous lui rendez visite quand il vous dit que ses grands-parents sont passés juste avant vous. Vous lui faites remarquer qu'ils sont morts il y a plusieurs décennies, mais il vous assure qu'ils sont venus le voir.;;;;;;;;;;x;x
VIETmisc.8365.a;Are you really sure? Maybe you are imagining things.;En êtes-vous vraiment sûr ? Peut-être imaginez-vous des choses.;;;;;;;;;;;;x
VIETmisc.8365.b;Really! A truly marvelous thing. I hope they mean well.;Vraiment ! Une chose vraiment merveilleuse. J'espère qu'ils veulent bien faire.;;;;;;;;;;;;x
VIETmisc.8365.c;Perhaps they did come. The universe is full of mysteries.;Ils sont peut-être venus. L'univers est plein de mystères.;;;;;;;;;;;;x
VIETmisc.8366.desc;You receive word that your trusted guard who recently got injured and was on his deathbed just passed away. Strangely, the day before that, his relatives said he told them that his grandparents came to help him pack for a journey. Could that have been a sign of things to come? Strange things have always preceded death, after all, as the stories tell.;Vous apprenez que votre garde de confiance, qui a été récemment blessé et se trouvait sur son lit de mort, vient de décéder. Bizarrement, la veille, ses proches ont dit qu'il leur avait dit que ses grands-parents étaient venus l'aider à faire ses affaires pour un voyage. Cela aurait-il pu être un signe des choses à venir ? Après tout, des choses étranges ont toujours précédé la mort, comme le racontent les histoires.;;;;;;;;;;x;x
VIETmisc.8366.a;He will be missed.;Il nous manquera.;;;;;;;;;;;;x
VIETmisc.8367.desc;On an official trip, you are passing by one of the villages of your realm. As you leave the borders of the village, you see something odd by a bush and, together with your entourage, go to investigate. To your shock, it is the corpse of a haggard-looking old man in rags. You demand an explanation from the villagers, who say he was the local town beggar who just passed away.;Lors d'un voyage officiel, vous passez par un des villages de votre royaume. En quittant les limites du village, vous apercevez quelque chose de bizarre près d'un buisson et, avec votre entourage, vous allez enquêter. À votre grand étonnement, il s'agit du cadavre d'un vieil homme en haillons à l'air hagard. Vous exigez une explication des villageois, qui disent qu'il s'agit du mendiant de la ville qui vient de mourir.;;;;;;;;;;x;x
VIETmisc.8367.a;I see. Very well, it is none of my concern - carry on.;Je vois. Très bien, cela ne me concerne pas - continuez.;;;;;;;;;;;;x
VIETmisc.8367.b;Please dispose of the corpse, will you? It's unclean.;Veuillez vous débarrasser du cadavre, s'il vous plaît. Il est impur.;;;;;;;;;;;;x
VIETmisc.8367.c;Beggar or not, everyone deserves to be treated with dignity!;Mendiant ou non, chacun mérite d'être traité avec dignité !;;;;;;;;;;;;x
VIET_beggars_deserve_dignified_burials_too; \n\nYou make the villagers give the man a proper funeral. Yet instead of being angry, the villagers are moved by your compassion.; \n\nVous faites en sorte que les villageois lui donnent des funérailles convenables. Mais au lieu d'être en colère, les villageois sont émus par votre compassion.;;;;;;;;;;x;x
VIETmisc.8368.desc;There are those who argue a quick death is better, for it will be less painful and you won't have as much to worry and ruminate over. Others believe a slow and gradual death is preferable, for it gives one time to let go of regrets, pray, and make peace with one's family, friends, and [Root.Religion.GetHighGodName].;Certains prétendent qu'une mort rapide est préférable, car elle sera moins douloureuse et vous n'aurez pas autant de soucis à vous faire et à ruminer. D'autres pensent qu'une mort lente et progressive est préférable, car elle permet de se débarrasser de ses regrets, de prier et de faire la paix avec sa famille, ses amis et [Root.Religion.GetHighGodName].;;;;;;;;;;x;x
VIETmisc.8368.a;I prefer a quick death - things are simpler that way.;Je préfère une mort rapide - les choses sont plus simples de cette façon.;;;;;;;;;;;;x
VIETmisc.8368.b;It's better if one has time to prepare before passing on.;Il est préférable d'avoir le temps de se préparer avant de passer à autre chose.;;;;;;;;;;;;x
VIETmisc.8369.desc;Several hooligans were recently caught trying to raid a cemetery not too far from where I live, and they were apprehended by the local watchmen. This, of course, is absolutely forbidden out of respect for the spirits of the dead, and it is now up to me to determine the fate of these men.;Plusieurs hooligans ont récemment été pris en train d'essayer de faire un raid dans un cimetière pas trop loin de chez moi, et ils ont été appréhendés par les gardiens locaux. Cela est bien sûr absolument interdit par respect pour les esprits des morts, et c'est maintenant à moi de déterminer le sort de ces hommes.;;;;;;;;;;x;x
VIETmisc.8369.a;Release the desperate, poor men. They've learned their lesson.;Libérez les hommes pauvres et désespérés. Ils ont appris leur leçon.;;;;;;;;;;;;x
VIETmisc.8369.b;To think they wanted to desecrate the dead! Toss them in prison.;Dire qu'ils voulaient profaner les morts ! Les jeter en prison.;;;;;;;;;;;;x
VIETmisc.8370.desc;Stories abound of ghosts frequently passing through a village in [Root.GetName]. The locals are of two minds, unsure on how to react to this. Some are terrified, and believe it is best to send in holy men and women to exorcise these restless spirits. Others view this through a more rational lens, seeing it as a blessing and an opportunity to honor and say prayers to the dead. Yet others say these are all just some hallucinations by deranged individuals.;Les histoires abondent sur les fantômes qui passent fréquemment dans un village de [Root.GetName]. Les habitants du village sont divisés en deux camps, et ne savent pas trop comment réagir à cette situation. Certains sont terrifiés et pensent qu'il est préférable d'envoyer des hommes et des femmes saints pour exorciser ces esprits agités. D'autres voient cela d'un point de vue plus rationnel, y voyant une bénédiction et une occasion d'honorer et de dire des prières aux morts. D'autres encore disent que ce ne sont que des hallucinations de personnes dérangées.;;;;;;;;;;x;x
VIETmisc.8370.a;Strange stories, indeed! Who knows what the truth is?;D'étranges histoires, en effet ! Qui sait ce qu'est la vérité ?;;;;;;;;;;;;x
VIETmisc.8371.desc;In one of the larger villages of [Root.GetName], a respected elder recently passed away. He was beloved by all for his virtue and wisdom. Few had anything bad to say about him. His funeral attracted many who wished to pay their respects to him, and some even claim that his spirit will provide the land with many blessings before he passes into the afterlife.;Dans l'un des plus grands villages de [Root.GetName], un ancien respecté est récemment décédé. Il était aimé de tous pour sa vertu et sa sagesse. Peu de gens avaient quelque chose de mal à dire à son sujet. Ses funérailles ont attiré de nombreuses personnes qui ont souhaité lui rendre hommage, et certains prétendent même que son esprit apportera de nombreuses bénédictions à la terre avant qu'il ne passe dans l'au-delà.;;;;;;;;;;x;x
VIETmisc.8371.a;May his soul rest in peace.;Que son âme repose en paix.;;;;;;;;;;;;x
VIETmisc.8372.desc;Last night, I was in bed when I heard a noise. Alarmed, I sat up, and saw a young man pacing to and fro, as if busy with some matter. He apologized to me for the disturbance, and sheepishly said, "I apologize, my [Root.GetLordLady]. I need to take care of business in the underworld and accidentally stumbled here." We exchanged small talk before he left. The next morning, when I asked the people of my household about it, no one reported ever seeing such a man. It is most bizarre! ;Hier soir, j'étais au lit quand j'ai entendu un bruit. Alarmé, je me suis assis et j'ai vu un jeune homme qui faisait les cent pas, comme s'il était occupé à quelque chose. Il s'est excusé auprès de moi pour le dérangement et m'a dit d'un air penaud : "Je m'excuse, mon [Root.GetLordLady]. Je dois m'occuper d'affaires dans le monde souterrain et je suis accidentellement tombé ici". Nous avons échangé quelques mots avant qu'il ne parte. Le lendemain matin, quand j'ai interrogé les gens de ma maisonnée à ce sujet, personne n'a déclaré avoir jamais vu un tel homme. C'est très bizarre ! ;;;;;;;;;;x;x
VIETmisc.8372.a;Maybe it was just a dream, yet it did not feel like a dream....;Peut-être n'était-ce qu'un rêve, mais il ne ressemblait pas à un rêve....;;;;;;;;;;;;x
VIETmisc.8373.desc;I am walking down the road when a pretty young woman in white robes approaches me. On her shoulder is a pet owl, though for some reason I suddenly recall that the sacred animal of the [Root.Religion.GetName] deity of death, Giltine, was an owl. The girl smiles, revealing an oddly long tongue, and she asks if she can kiss me. As her owl flutters away, I feel something is off.;Je marche sur la route quand une jolie jeune femme en robe blanche s'approche de moi. Sur son épaule se trouve une chouette, bien que pour une raison quelconque, je me souvienne soudain que l'animal sacré de la divinité de la mort [Root.Religion.GetName], Giltine, était une chouette. La fille sourit, révélant une langue étrangement longue, et elle demande si elle peut m'embrasser. Alors que sa chouette s'éloigne en battant des ailes, je sens que quelque chose ne va pas.;;;;;;;;;;x;x
VIETmisc.8373.a;I hastily make an excuse and leave the stranger alone.;Je m'empresse de trouver une excuse et de laisser l'étrangère tranquille.;;;;;;;;;;;;x
VIETmisc.8373.b;Oh, I'm just nervous! Come to me, my beauty!;Oh, je suis juste nerveux ! Viens à moi, ma beauté !;;;;;;;;;;;;x
VIETmisc.8374.desc;The girl moves forward, but her tongue suddenly extends forth, becoming unnaturally long. Her pretty visage turns into that of an old, withered hag. I am trapped, unable to move. She licks my face, and I feel darkness overtake me.... And then I wake up. It was just a nightmare, but how was I that stupid to be seduced by the Goddess of Death! An ill omen, but at least it was just a dream.;La jeune fille avance, mais sa langue s'allonge soudainement, devenant anormalement longue. Son joli visage se transforme en celui d'une vieille sorcière flétrie. Je suis piégée, incapable de bouger. Elle me lèche le visage, et je sens l'obscurité m'envahir.... Et puis je me réveille. Ce n'était qu'un cauchemar, mais comment ai-je pu être aussi stupide pour être séduit par la Déesse de la Mort ! Un mauvais présage, mais au moins ce n'était qu'un rêve.;;;;;;;;;;x;x
VIETmisc.8374.a;Right...?;Vraiment ... ?;;;;;;;;;;;;x
VIETmisc.8375.desc;Shortly before a respected member of the local [Root.Culture.GetName] community died recently, several relatives claimed to witness the shrieking and wailing of banshees, both of gruesome or comely visage. Today, though, I wondered to myself: while people understandably fear these female spirits, isn't it nice to have a warning when something bad might happen?;Peu avant la mort récente d'un membre respecté de la communauté locale [Root.Culture.GetName], plusieurs parents ont déclaré avoir été témoins des cris et des gémissements des banshees, au visage macabre ou avenant. Aujourd'hui, cependant, je me suis demandé : alors que les gens craignent, à juste titre, ces esprits féminins, n'est-il pas agréable d'être averti quand quelque chose de mal peut arriver ?;;;;;;;;;;x;x
VIETmisc.8375.a;At least that's what I think.;Du moins, c'est ce que je pense.;;;;;;;;;;;;x
VIETmisc.8375.b;It's stupid superstition either way.;C'est une superstition stupide de toute façon.;;;;;;;;;;;;x
VIETmisc.8376.desc.a;[target_VIET_myling_courtier.GetTitledName] claimed that last night, [target_VIET_myling_courtier.GetSheHe] came across a Myling - the ghost of a dead child who had been wrongly killed by its parents. [target_VIET_myling_courtier.GetFirstName] knew it was a dangerous but inescapable situation, and rushed to guide the child to a nearby cemetery, a hallowed ground. Yet, contrary to the scary [Root.Religion.GetName] tales, the child was friendly and thanked [target_VIET_myling_courtier.GetFirstName] for [target_VIET_myling_courtier.GetHerHis] compassion.;[target_VIET_myling_courtier.GetTitledName] a déclaré que la nuit dernière, [target_VIET_myling_courtier.GetSheHe] a rencontré un Myling - le fantôme d'un enfant mort qui avait été tué à tort par ses parents. [target_VIET_myling_courtier.GetFirstName] savait que c'était une situation dangereuse mais inévitable, et s'est empressé de guider l'enfant vers un cimetière voisin, une terre sacrée. Pourtant, contrairement aux récits effrayants de [Root.Religion.GetName], l'enfant s'est montré amical et a remercié [target_VIET_myling_courtier.GetFirstName] pour sa compassion.;;;;;;;;;;x;x
VIETmisc.8376.desc.b;[target_VIET_myling_courtier.GetTitledName] claimed that last night, [target_VIET_myling_courtier.GetSheHe] came across a Myling - the ghost of a dead child who had been wrongly killed by its parents. [target_VIET_myling_courtier.GetFirstName] knew it was a dangerous but inescapable situation, and rushed to guide the child to a nearby cemetery, a hallowed ground. Yet, contrary to the scary [Root.Culture.GetName] tales, the child was friendly and thanked [target_VIET_myling_courtier.GetFirstName] for [target_VIET_myling_courtier.GetHerHis] compassion.;[target_VIET_myling_courtier.GetTitledName] a déclaré que la nuit dernière, [target_VIET_myling_courtier.GetSheHe] a rencontré un Myling - le fantôme d'un enfant mort qui avait été tué à tort par ses parents. [target_VIET_myling_courtier.GetFirstName] savait que c'était une situation dangereuse mais inévitable, et s'est empressé de guider l'enfant vers un cimetière voisin, une terre sacrée. Pourtant, contrairement aux récits effrayants de [Root.Culture.GetName], l'enfant s'est montré amical et a remercié [target_VIET_myling_courtier.GetFirstName] pour sa compassion.;;;;;;;;;;x;x
VIETmisc.8376.a;Ha! An interesting tale. You always loved making up stories.;Ha ! Un récit intéressant. Vous avez toujours aimé inventer des histoires.;;;;;;;;;;;;x
VIETmisc.8376.b;It's either a dream or a lie. Mylings are vengeful beings, not harmless!;C'est soit un rêve, soit un mensonge. Les Mylings sont des êtres vengeurs, pas inoffensifs !;;;;;;;;;;;;x
VIETmisc.8376.c;Oh dear! At least the ghost seemed like a kind one.;Oh, mon Dieu ! Au moins, le fantôme avait l'air gentil.;;;;;;;;;;;;x
VIETmisc.8377.desc;On the road, my entourage and I come across a [Root.Religion.GetName] holy man, dressed in robes. He is kneeling on the ground, looking at nowhere in particular, as he chants some prayers.\n\nAfter he finishes, I ask him what he was doing, and he explains that recently, a woman died here in an accident. She was a poor woman with no family, so this holy man, out of compassion, gave her a modest but dignified funeral. He hopes her spirit will find peace with [Root.Religion.GetHighGodName].;Sur la route, mon entourage et moi rencontrons un saint homme [Root.Religion.GetName], vêtu d'une robe. Il est agenouillé sur le sol, ne regardant nulle part en particulier, alors qu'il chante quelques prières. Une fois qu'il a terminé, je lui demande ce qu'il faisait, et il m'explique que récemment, une femme est morte ici dans un accident. C'était une femme pauvre sans famille, alors ce saint homme, par compassion, lui a donné des funérailles modestes mais dignes. Il espère que son esprit trouvera la paix avec [Racine.Religion.GetHighGodName].;;;;;;;;;;x;x
VIETmisc.8377.a;For a mere peasant? What a waste of time.;Pour un simple paysan ? Quelle perte de temps.;;;;;;;;;;;;x
VIETmisc.8377.b;I understand. Carry on, then. We shan't bother you.;Je comprends. Continuez, alors. Nous ne vous dérangerons pas.;;;;;;;;;;;;x
VIETmisc.8377.c;How noble! May we join you in praying for her spirit?;Comme c'est noble ! Pouvons-nous nous joindre à vous pour prier pour son esprit ?;;;;;;;;;;;;x
VIETmisc.8378.desc;A most amusing yet strange tale! I know of this noblewoman in my realm who is quite annoying. She's not a bad person, but she's unbelievably chatty and intensely emotional, and if crossed can be quite a nag. Though middle aged, she died a few weeks ago... only to come back to life a few hours later. She said that apparently Death came to get her, but was so fed up with her company that he hurried to take her back home so he could come get her later. She's still healthy today.;Une histoire des plus amusantes et étranges ! Je connais dans mon royaume une femme noble qui est assez agaçante. Ce n'est pas une mauvaise personne, mais elle est incroyablement bavarde et intensément émotive, et si on la contrarie, elle peut être très ennuyeuse. Bien qu'elle soit d'âge moyen, elle est morte il y a quelques semaines... pour revenir à la vie quelques heures plus tard. Elle a dit qu'apparemment la Mort était venue la chercher, mais qu'elle en avait tellement marre de sa compagnie qu'elle s'est empressée de la ramener à la maison pour pouvoir venir la chercher plus tard. Elle est encore en bonne santé aujourd'hui.;;;;;;;;;;x;x
VIETmisc.8378.a;Ha ha! I do feel sorry for old Death.;Ha ha ! Je suis vraiment désolé pour la vielle Mort.;;;;;;;;;;;;x
VIETmisc.8378.b;She was seeing things at the time, but that's funny.;Elle voyait des choses à l'époque, mais c'est drôle.;;;;;;;;;;;;x
VIETmisc.8379.desc;I rest in bed one evening when I hear a knock on the door. Thinking it is one of my servants, I beckon them in, only to see a pleasant young woman I do not recognize. Suddenly, there is a chill in the air, and the candles flicker out. The stranger looks at me with her dark eyes, and I hold my breath in anticipation. "I am Death," she says in a low, yet soothing whisper. "It's time for...";Un soir, je me repose dans mon lit quand j'entends frapper à la porte. Pensant qu'il s'agit d'un de mes serviteurs, je leur fais signe d'entrer, pour voir ensuite une jeune femme agréable que je ne reconnais pas. Soudain, l'air se refroidit et les bougies s'éteignent. L'inconnue me regarde avec ses yeux noirs et je retiens mon souffle dans l'attente. "Je suis la Mort", dit-elle dans un murmure bas mais apaisant. "Il est temps de ...";;;;;;;;;;x;x
VIETmisc.8379.a;Wait... what's going on?;Attends ... qu'est-ce qui se passe ?;;;;;;;;;;;;x
VIETmisc.8380.tooltip; \n\nIs it... is it time for me to go?; \n\nEst-il... est-il temps pour moi de partir ?;;;;;;;;;;x;x
VIETmisc.8380.title;Common Mistake;Erreur courante;;;;;;;;;;x;x
